doc_id,parser_name,text_sha1,char_count,primary_category,title,label,stream_type
2604.00187v1,pymupdf,d4fa91649d64720ad3e3d2cff9b4d8f9cedd2900,28943,cs.HC,"Explainable AI for Blind and Low-Vision Users: Navigating Trust, Modality, and Interpretability in the Agentic Era",0,online_same_domain_stream
2603.23405v1,pypdf,055fa1f4d475f1766cf64d3e81b5db4294d7fce5,65178,cs.MA,Planning over MAPF Agent Dependencies via Multi-Dependency PIBT,1,online_same_domain_stream
2601.21525v1,pypdf,23f235ce218775285f0892cc5034cf5f8520c9d3,76092,cs.CL,LMK > CLS: Landmark Pooling for Dense Embeddings,1,online_same_domain_stream
2601.06238v1,pypdf,3186829f508ad59c90f42d9a9670d1e5206e2454,220510,cs.LG,SPINAL -- Scaling-law and Preference Integration in Neural Alignment Layers,1,online_same_domain_stream
2603.28324v1,pymupdf,7cdaa42bab9987af39a1c6b91989ffea04b9a5c8,102213,stat.ML,LDDMM stochastic interpolants: an application to domain uncertainty quantification in hemodynamics,1,online_same_domain_stream
2603.28939v1,pypdf,56eb7a022032783b7659ac1a2750841d45c070f1,120900,cs.LG,Foundations of Polar Linear Algebra,1,online_same_domain_stream
2604.01186v1,pymupdf,7f4bd43182496b138d69a247a4042f56a3dba066,14509,cs.DL,From Validity to Inter-Subjectivity: An Argument for Reliability Signals in Search Environments,0,online_same_domain_stream
2603.26516v1,pymupdf,4453c54451ff42110acdae75934624cff56a6a65,45041,cs.CL,ALBA: A European Portuguese Benchmark for Evaluating Language and Linguistic Dimensions in Generative LLMs,1,online_same_domain_stream
2603.17425v1,pypdf,3db2900ce415696b3882bb5356173d5ea7d06089,28837,cs.AI,"Proactive Knowledge Inquiry in Doctor-Patient Dialogue: Stateful Extraction, Belief Updating, and Path-Aware Action Planning",0,online_same_domain_stream
2603.27021v1,pymupdf,7ff95ef73fc867b9d669cd60c1fc62cd4e6f471c,23173,cs.CL,Pashto Common Voice: Building the First Open Speech Corpus for a 60-Million-Speaker Low-Resource Language,1,online_same_domain_stream
2603.18428v1,pypdf,d047d73047f903cd9338bbc59d78070eb3f22cdd,33076,cs.CL,Adaptive Decoding via Test-Time Policy Learning for Self-Improving Generation,1,online_same_domain_stream
2603.27156v1,pypdf,f3f05474ef7b1e79bb35fb6314b75c8789c78f54,40422,cs.LG,GSR-GNN: Training Acceleration and Memory-Saving Framework of Deep GNNs on Circuit Graph,0,online_same_domain_stream
2603.28251v1,pymupdf,5b1b2741062a05cd12669d9b81618e2e098869b5,44058,cs.CV,DiffAttn: Diffusion-Based Drivers' Visual Attention Prediction with LLM-Enhanced Semantic Reasoning,0,online_same_domain_stream
2601.05038v1,pypdf,b6a7c990218d1d7b20b8ef33487ec85a61923353,51370,cs.CL,ArcAligner: Adaptive Recursive Aligner for Compressed Context Embeddings in RAG,0,online_same_domain_stream
2604.00580v1,pymupdf,d1cdcc2dc4f981b55a1799166c24a7c10ec612a4,92337,cs.LG,Representation choice shapes the interpretation of protein conformational dynamics,0,online_same_domain_stream
2603.29345v1,pymupdf,0ab0b48f3d7c8f2bc719d47365e3d38e59bf6d5e,67152,cs.CL,Open Machine Translation for Esperanto,0,online_same_domain_stream
2603.23146v1,pypdf,dec2905e87ab3a85a60f97c22b8b30f4f02b8860,67829,cs.CL,Why AI-Generated Text Detection Fails: Evidence from Explainable AI Beyond Benchmark Accuracy,1,online_same_domain_stream
2602.17544v1,pypdf,6532117e867a78185618985fcde22f9c9da841ef,26574,cs.AI,Evaluating Chain-of-Thought Reasoning through Reusability and Verifiability,1,online_same_domain_stream
2603.18377v2,pypdf,cd97782c5505f9b6d43f7b088d3e5d3ae0ebf4c2,99134,cs.CR,PlanTwin: Privacy-Preserving Planning Abstractions for Cloud-Assisted LLM Agents,0,online_same_domain_stream
2604.00241v1,pypdf,2f0ce9478c15b6d6724afc399fa1c0ec77b8e318,30521,cs.LG,Softmax gradient policy for variance minimization and risk-averse multi armed bandits,1,online_same_domain_stream
2601.17692v1,pypdf,c15e803f0d3b692216b430cc6858b78dc7cf773e,102287,cs.IR,LegalMALR:Multi-Agent Query Understanding and LLM-Based Reranking for Chinese Statute Retrieval,1,online_same_domain_stream
2603.19809v1,pymupdf,64120436a3d7b20533577a7e2f7c684ffebe722d,58656,cs.IR,How Well Does Generative Recommendation Generalize?,0,online_same_domain_stream
2603.26046v1,pymupdf,c30af57ecbe57bd2df1a5b1dc17c6b6a209af6a7,22160,cs.CL,Retrieval-Augmented Generation Based Nurse Observation Extraction,0,online_same_domain_stream
2603.22918v2,pypdf,b52bec440871e10dbe9ef6514677315ccc27c266,69432,cs.CV,EVA: Efficient Reinforcement Learning for End-to-End Video Agent,1,online_same_domain_stream
2603.27001v1,pypdf,db6e0de73a1698dec6c4b009572aefd34333ce01,31595,eess.AS,PHONOS: PHOnetic Neutralization for Online Streaming Applications,0,online_same_domain_stream
2602.23999v1,pypdf,2ca5bc8d76580a29bb25c5e9075c0e1e9e29f924,85173,cs.DB,GPU-Native Approximate Nearest Neighbor Search with IVF-RaBitQ: Fast Index Build and Search,0,online_same_domain_stream
2603.24470v1,pypdf,2cc4ceb3e51ea3bb09d8e72536a691fff8a76120,24501,cs.CV,Counting Without Numbers \& Finding Without Words,0,online_same_domain_stream
2603.19849v1,pypdf,193d24e8b32c36b0791d313e54c1d4fbc55ac24b,24824,cs.CL,Semantic Delta: An Interpretable Signal Differentiating Human and LLMs Dialogue,0,online_same_domain_stream
2603.25489v1,pypdf,fb80bd724a89682796de2ca090d51043b0bb93a9,60732,cs.CL,Translation Asymmetry in LLMs as a Data Augmentation Factor: A Case Study for 6 Romansh Language Varieties,0,online_same_domain_stream
2603.27349v1,pypdf,a18198c229c212fbab1ae7e319f47e5477636e65,25153,cs.CV,Inference-Time Structural Reasoning for Compositional Vision-Language Understanding,0,online_same_domain_stream
2603.00097v1,pypdf,0fceae3d9076987038ba4b5a733c5bbcf7892033,48093,q-bio.BM,Exploring Drug Safety Through Knowledge Graphs: Protein Kinase Inhibitors as a Case Study,0,online_same_domain_stream
2604.01216v1,pypdf,8630961e36671ac4333d9d1b837f64ea3fe376f3,101647,cs.LG,LAtent Phase Inference from Short time sequences using SHallow REcurrent Decoders (LAPIS-SHRED),1,online_same_domain_stream
2603.26807v1,pypdf,c5d3f9859aff3bb784f7f44c0e602a35749867cd,43893,cs.IR,GroupRAG: Cognitively Inspired Group-Aware Retrieval and Reasoning via Knowledge-Driven Problem Structuring,0,online_same_domain_stream
2604.01215v1,pymupdf,99a0582e0880b94d2ea3a6e31ab9a484cc15a665,180104,cs.LG,The Recipe Matters More Than the Kitchen:Mathematical Foundations of the AI Weather Prediction Pipeline,1,online_same_domain_stream
2603.23848v1,pypdf,d164a6857822947954953edd393475dfa95f2026,51167,cs.CL,BeliefShift: Benchmarking Temporal Belief Consistency and Opinion Drift in LLM Agents,0,online_same_domain_stream
2603.20034v1,pypdf,d457cf6b415d33c047840efe40c94bf7a615384e,50561,cs.IR,CoverageBench: Evaluating Information Coverage across Tasks and Domains,1,online_same_domain_stream
2603.06660v1,pymupdf,ddc8dc97295290237c8e69e5dc8ef8246c26e3b7,82799,cs.IR,Approximate Nearest Neighbor Search for Modern AI: A Projection-Augmented Graph Approach,0,online_same_domain_stream
2604.01161v1,pymupdf,c3b2d54edcc459e0503842777a4a755c0ed2f22b,37791,cs.LG,Reasoning Shift: How Context Silently Shortens LLM Reasoning,0,online_same_domain_stream
2603.16839v1,pypdf,3a71a558ae56a2dd531f5401957dfe377084987e,51451,cs.AI,Learning to Present: Inverse Specification Rewards for Agentic Slide Generation,0,online_same_domain_stream
2602.15005v1,pypdf,50b2aae14afbea9648a6facc21f55f5a70005d74,36060,cs.CL,Learning User Interests via Reasoning and Distillation for Cross-Domain News Recommendation,0,online_same_domain_stream
2604.00248v1,pymupdf,e97eb458b750fb97aa0dc01919e166a89828d3ce,42266,cs.CL,REM-CTX: Automated Peer Review via Reinforcement Learning with Auxiliary Context,0,online_same_domain_stream
2603.27335v1,pymupdf,296577d7ce1eb96d7d220a5644c882b671a21d7d,77386,cs.CL,PubMed Reasoner: Dynamic Reasoning-based Retrieval for Evidence-Grounded Biomedical Question Answering,0,online_same_domain_stream
2603.26982v1,pymupdf,f7ab4ee5f4c083019bab27aa6c91d0af761a7569,24828,stat.ML,Online Statistical Inference of Constant Sample-averaged Q-Learning,1,online_same_domain_stream
2603.29768v1,pypdf,aaa649da048cf350ad31369e9732aee2b5bf1492,71039,cs.LG,Big2Small: A Unifying Neural Network Framework for Model Compression,1,online_same_domain_stream
2604.00394v1,pypdf,51a727eefe9ad7db28e04b53677f415c11464ed9,37347,cs.LG,Deep Networks Favor Simple Data,0,online_same_domain_stream
2603.29541v1,pypdf,fb18c7bdc5ad24f63fe773753a3b5b2fa92c22d3,36898,cs.CL,Can LLM Agents Identify Spoken Dialects like a Linguist?,0,online_same_domain_stream
2603.27404v1,pypdf,d1e0f6ac834397af5754f487eb8d7a9def50c326,40951,cs.AI,Heterogeneous Debate Engine: Identity-Grounded Cognitive Architecture for Resilient LLM-Based Ethical Tutoring,0,online_same_domain_stream
2604.00388v1,pypdf,018c138595c2e37a69f157e46fc467c9542c610d,37221,cs.LG,Gradient-Based Data Valuation Improves Curriculum Learning for Game-Theoretic Motion Planning,1,online_same_domain_stream
2603.29979v1,pypdf,aae2c42dc9675c2de1381484ae482a7029965e48,45670,cs.CL,Structural Feature Engineering for Generative Engine Optimization: How Content Structure Shapes Citation Behavior,0,online_same_domain_stream
2603.22922v1,pypdf,68b443d84f5a987fb91a426032d31b8016068abf,41498,cs.CL,Quality Over Clicks: Intrinsic Quality-Driven Iterative Reinforcement Learning for Cold-Start E-Commerce Query Suggestion,0,online_same_domain_stream
2601.20131v1,pymupdf,b77e283a4f2137cdb4068fcc62be05f94d18e9a5,110496,cs.IR,Taxonomy of the Retrieval System Framework: Pitfalls and Paradigms,0,online_same_domain_stream
2603.25253v1,pypdf,010a149928187ca61f288ceb6b17d12722565d25,60196,cs.CL,MolQuest: A Benchmark for Agentic Evaluation of Abductive Reasoning in Chemical Structure Elucidation,0,online_same_domain_stream
2603.00267v1,pymupdf,b5817d978f9adcd3a3f25c6e13c00aaf6fe63de4,67386,cs.AI,"Multi-Sourced, Multi-Agent Evidence Retrieval for Fact-Checking",1,online_same_domain_stream
2603.23251v1,pypdf,abdcfd9ec0d4718e4526a796546e1f423f027a9e,66881,cs.CL,"Is AI Catching Up to Human Expression? Exploring Emotion, Personality, Authorship, and Linguistic Style in English and Arabic with Six Large Language Models",0,online_same_domain_stream
2603.26332v1,pypdf,45b8902b27571f72cd57965b2cda4d06fdab21da,55757,cs.CL,CALRK-Bench: Evaluating Context-Aware Legal Reasoning in Korean Law,1,online_same_domain_stream
2603.27838v1,pypdf,be799734c88b06f18b58766f567bff1f74a11095,54728,cs.CL,ProText: A benchmark dataset for measuring (mis)gendering in long-form texts,1,online_same_domain_stream
2603.29216v1,pypdf,83913f50a98e711a6123d75c5a50e86b71a2c413,60160,cs.SE,Software Vulnerability Detection Using a Lightweight Graph Neural Network,1,online_same_domain_stream
2603.28716v1,pypdf,8469550f9336138b852009dcf56d2546c0651afc,45015,cs.AI,Dynamic Dual-Granularity Skill Bank for Agentic RL,1,online_same_domain_stream
2603.25770v1,pymupdf,1b643e887b6bfb150876e372df78b8a4d60f266c,93443,cs.SE,ReCUBE: Evaluating Repository-Level Context Utilization in Code Generation,0,online_same_domain_stream
2603.29042v1,pymupdf,4feee699d2022682bab787bdcfe943b10478708c,29322,cs.CL,An Empirical Recipe for Universal Phone Recognition,1,online_same_domain_stream
2603.24326v1,pypdf,87fa35c9b3d77c140006b97588128b81bd8d2505,70067,cs.CV,Boosting Document Parsing Efficiency and Performance with Coarse-to-Fine Visual Processing,0,online_same_domain_stream
2602.13179v1,pypdf,a5ed2806547ce522b329a6a8aa2e86839c876692,115708,cs.IR,Fix Before Search: Benchmarking Agentic Query Visual Pre-processing in Multimodal Retrieval-augmented Generation,1,online_same_domain_stream
2602.22529v1,pymupdf,116b7e0a8dbb8e2fcba7d852ef7ea69670d665cf,51343,cs.IR,Generative Agents Navigating Digital Libraries,1,online_same_domain_stream
2603.20513v1,pymupdf,4b27ceb8de556a6433b3754bcb2103f7a2713052,41237,cs.IR,ReBOL: Retrieval via Bayesian Optimization with Batched LLM Relevance Observations and Query Reformulation,1,online_same_domain_stream
2604.01202v1,pypdf,3207e6c27898385cce79d7bd958ab11109dfc0ae,48935,cs.AI,Therefore I am. I Think,1,online_same_domain_stream
2603.30022v1,pypdf,c334aa1948decda6420dac4b35bfaa18ad903c8b,19776,cs.RO,Hybrid Framework for Robotic Manipulation: Integrating Reinforcement Learning and Large Language Models,1,online_same_domain_stream
2603.25741v2,pypdf,69015bfaa412f3774143319f7e6956b79ab34dcd,55813,cs.CV,Vega: Learning to Drive with Natural Language Instructions,1,online_same_domain_stream
2511.13489v1,pymupdf,10041f878ff76d885c2a383849a42bf4b8a04f1f,44164,cs.ET,PolicyBot - Reliable Question Answering over Policy Documents,0,online_same_domain_stream
2508.05664v1,pymupdf,e7104b40189016cfe2c4ea4ce5580180778b3676,14057,cs.IR,Enhancing Retrieval-Augmented Generation for Electric Power Industry Customer Support,1,online_same_domain_stream
2603.27850v1,pymupdf,33fc4dca79879f774daaa170a67c709506b00d29,70038,cs.SE,EffiSkill: Agent Skill Based Automated Code Efficiency Optimization,0,online_same_domain_stream
2602.12819v1,pypdf,e9f6925ac50bfed3d14c5d3c7f196adcd3ccde35,21055,cs.IR,"WISE: A Multimodal Search Engine for Visual Scenes, Audio, Objects, Faces, Speech, and Metadata",1,online_same_domain_stream
2604.00352v1,pymupdf,a33a2b8aacbdabcc5d0707e460bf09ee43f75faa,50186,cs.LG,Deep Learning-Accelerated Surrogate Optimization for High-Dimensional Well Control in Stress-Sensitive Reservoirs,1,online_same_domain_stream
2603.28201v1,pypdf,2465f1052aef9ed9ff194187f8e9ec0267d543a3,114363,cs.LG,A Perturbation Approach to Unconstrained Linear Bandits,0,online_same_domain_stream
2603.26815v1,pypdf,7b1994ca2e67b3bfe46f598b550ee728af714ae4,71957,cs.CL,Resolving the Robustness-Precision Trade-off in Financial RAG through Hybrid Document-Routed Retrieval,1,online_same_domain_stream
2603.23998v1,pymupdf,d3e99228e0abdbe3d25807a65131c21884cfa1de,101883,cs.CL,Sparse Growing Transformer: Training-Time Sparse Depth Allocation via Progressive Attention Looping,0,online_same_domain_stream
2602.23620v1,pymupdf,d9c3bfc4f1d5cd725ee694f4567905d2712c11c3,27766,cs.IR,Synthetic Data Powers Product Retrieval for Long-tail Knowledge-Intensive Queries in E-commerce Search,1,online_same_domain_stream
2603.28213v1,pypdf,f5edb3ba239bcf85f752af63a2b382d213cf1fff,69324,cs.CL,"\textit{Versteasch du mi?} Computational and Socio-Linguistic Perspectives on GenAI, LLMs, and Non-Standard Language",0,online_same_domain_stream
2603.26182v1,pymupdf,81f098852995eebeed63a0ccd018c8e09ede6b3f,70777,cs.CL,ClinicalAgents: Multi-Agent Orchestration for Clinical Decision Making with Dual-Memory,1,online_same_domain_stream
2604.00402v1,pypdf,534cb7b641f5ece5d6ce9fdc6e92268e9f5142b6,17398,cs.CV,COTTA: Context-Aware Transfer Adaptation for Trajectory Prediction in Autonomous Driving,1,online_same_domain_stream
2603.26363v1,pymupdf,b6221ce8b7c679126d150fb98b9c5ea91e31cf24,62764,cs.LG,A Formal Framework for Uncertainty Analysis of Text Generation with Large Language Models,0,online_same_domain_stream
2602.23999v1,pymupdf,bfb255e5164c32d10b627c3a5bb6a5af34d0edbb,85339,cs.DB,GPU-Native Approximate Nearest Neighbor Search with IVF-RaBitQ: Fast Index Build and Search,1,online_same_domain_stream
2602.02888v1,pymupdf,65e53a245aadec18f00bca6eba77a6d0e08565b3,79431,cs.CL,HALT: Hallucination Assessment via Log-probs as Time series,1,online_same_domain_stream
2510.14824v1,pypdf,4cdd8685c0b0ea28e38fad5751eb2f1777c723c1,69356,cs.CL,Supervised Fine-Tuning or Contrastive Learning? Towards Better Multimodal LLM Reranking,0,online_same_domain_stream
2603.28460v2,pymupdf,1719d31332085a253fbef4d71a744c2bf1271f79,49452,cs.CV,$R_\text{dm}$: Re-conceptualizing Distribution Matching as a Reward for Diffusion Distillation,1,online_same_domain_stream
2604.00074v1,pypdf,dd99c33d0ae5c515328ba2ad978ca6ebbafdb9bf,68143,cs.LG,PASM: Population Adaptive Symbolic Mixture-of-Experts Model for Cross-location Hurricane Evacuation Decision Prediction,1,online_same_domain_stream
2603.22186v1,pymupdf,a883a8fbc2a5c05813e3bdbc9e08cd3322a9bfb2,22280,cs.CL,Enhancing Document-Level Machine Translation via Filtered Synthetic Corpora and Two-Stage LLM Adaptation,0,online_same_domain_stream
2603.28474v1,pypdf,73205bc84fc06a82f12a584109e1f57ccce73fa2,87053,cs.CV,"CiQi-Agent: Aligning Vision, Tools and Aesthetics in Multimodal Agent for Cultural Reasoning on Chinese Porcelains",1,online_same_domain_stream
2603.23301v1,pypdf,f602adf817b5f57a2563814cf9c0865928f9a93c,84871,cs.CL,Steering LLMs for Culturally Localized Generation,0,online_same_domain_stream
2603.27355v1,pypdf,2f08a59da51882eb923f43f2db1786dda697d8da,49395,cs.AI,"LLM Readiness Harness: Evaluation, Observability, and CI Gates for LLM/RAG Applications",1,online_same_domain_stream
2604.00508v1,pymupdf,5988ddb5c3a2035f44ca5491385454df69408baa,128069,cs.LG,A Decoupled Basis-Vector-Driven Generative Framework for Dynamic Multi-Objective Optimization,1,online_same_domain_stream
2603.29937v1,pypdf,1a0e078e1880bde09d110981efac43f551eff602,33142,cs.CL,Rewrite the News: Tracing Editorial Reuse Across News Agencies,0,online_same_domain_stream
2603.25640v1,pypdf,e0959a3b9a4578f147fa6cd8824f9dc2e4fc3e2e,34770,cs.DL,RenoBench: A Citation Parsing Benchmark,1,online_same_domain_stream
2603.26122v1,pypdf,ad3406140f29f3ee38554562922626e9d43ea090,94683,cs.CV,SkinGPT-X: A Self-Evolving Collaborative Multi-Agent System for Transparent and Trustworthy Dermatological Diagnosis,0,online_same_domain_stream
2603.08117v3,pypdf,20934f95ff4e55120104fbeddfeb44087d1f1226,70517,cs.AI,UIS-Digger: Towards Comprehensive Research Agent Systems for Real-world Unindexed Information Seeking,0,online_same_domain_stream
2603.30025v1,pypdf,912e2d57176475120a43caf86133673bfadfa02d,79754,cs.CL,ContextClaim: A Context-Driven Paradigm for Verifiable Claim Detection,0,online_same_domain_stream
2602.02686v1,pymupdf,b169f482a6220ec05c3f85cacf50fb94d4eaed09,50243,cs.CL,Monotonicity as an Architectural Bias for Robust Language Models,1,online_same_domain_stream
2603.26688v1,pymupdf,2e96c10230cc7afb073e38fdd53d652eb4796941,125336,cs.IR,EVNextTrade: Learning-to-Rank-Based Recommendation of Next Charging Nodes for EV-EV Energy Trading,0,online_same_domain_stream
2603.29373v1,pymupdf,b6cf37b316c622471b2cd3a33bd600bcdccfe229,86908,cs.CL,Beyond Idealized Patients: Evaluating LLMs under Challenging Patient Behaviors in Medical Consultations,0,online_same_domain_stream
2603.29741v1,pymupdf,e4d971be77a87c4c4394c47fc12fb3839298917a,14177,cs.SI,BotVerse: Real-Time Event-Driven Simulation of Social Agents,1,online_same_domain_stream
2603.28643v1,pypdf,0ff245c492d15c4ee5cf6996b27a59ad1220e87a,104699,cs.AI,The Ultimate Tutorial for AI-driven Scale Development in Generative Psychometrics: Releasing AIGENIE from its Bottle,1,online_same_domain_stream
2603.21544v1,pypdf,40c105fa58f71f462875eb3b2b2c6db30076c889,59403,cs.NE,Evolutionary Biparty Multiobjective UAV Path Planning: Problems and Empirical Comparisons,0,online_same_domain_stream
2603.27745v1,pypdf,755608e0ab96d71d5dfdac1842fc1c8dfdb29d9c,65180,cs.SE,Needle in the Repo: A Benchmark for Maintainability in AI-Generated Repository Edits,1,online_same_domain_stream
2603.28662v1,pypdf,a8b184344fcff6e8713a6022419e89b6b9379444,53965,cs.LG,AMIGO: Agentic Multi-Image Grounding Oracle Benchmark,0,online_same_domain_stream
2604.00800v1,pymupdf,192e3447d1f181baea01f26297fdd03bfb82bdbc,51299,cs.LG,MIRANDA: MId-feature RANk-adversarial Domain Adaptation toward climate change-robust ecological forecasting with deep learning,0,online_same_domain_stream
2604.00770v1,pymupdf,55c1ba190e1590d47b4070806b3c594e87ae6637,55775,cs.LG,Thinking Wrong in Silence: Backdoor Attacks on Continuous Latent Reasoning,0,online_same_domain_stream
2603.23821v1,pypdf,73bb62372bd6bf8f4384fb19d092767c4df1daf5,106383,cs.CL,Perturbation: A simple and efficient adversarial tracer for representation learning in language models,1,online_same_domain_stream
2603.29981v1,pymupdf,afe1ddac7245c327976743364f72e600fd740a52,71994,cs.LG,Aligning Validation with Deployment: Target-Weighted Cross-Validation for Spatial Prediction,0,online_same_domain_stream
2602.15845v1,pypdf,9b3477ffbad35f90314efa75cac6620101bca8dd,125656,cs.CL,KD4MT: A Survey of Knowledge Distillation for Machine Translation,0,online_same_domain_stream
2603.18327v1,pypdf,808cd8b435230a3bc413f96b6f3f0de720c3d889,33982,cs.AI,Consumer-to-Clinical Language Shifts in Ambient AI Draft Notes and Clinician-Finalized Documentation: A Multi-level Analysis,1,online_same_domain_stream
2603.28108v1,pymupdf,66f5725e578ae92328a1e0bdf7dc3657a5dca5ec,44792,cs.DL,Quid est VERITAS? A Modular Framework for Archival Document Analysis,1,online_same_domain_stream
2603.22528v1,pypdf,99e6eb7678c65171fa6d226718e3c9a2196c4bf2,140961,cs.IR,GraphRAG for Engineering Diagrams: ChatP&ID Enables LLM Interaction with P&IDs,1,online_same_domain_stream
2603.23219v1,pymupdf,0bd98b631e6745fd603bfaf6cb15e3f1869b9e42,71177,cs.CL,Decoding AI Authorship: Can LLMs Truly Mimic Human Style Across Literature and Politics?,0,online_same_domain_stream
2603.27929v1,pymupdf,318dff0485d06fd130047476aacf82297cc78101,58678,cs.LG,Physics-Guided Transformer (PGT): Physics-Aware Attention Mechanism for PINNs,0,online_same_domain_stream
2509.02558v1,pypdf,d5636c71e51b8d95eb65022d5f33befcce139d13,47031,cs.IR,"Lighting the Way for BRIGHT: Reproducible Baselines with Anserini, Pyserini, and RankLLM",0,online_same_domain_stream
2603.19665v1,pymupdf,77076692d4492ba9f9e5535a067ee3e3508de438,26782,cs.IR,GenFacet: End-to-End Generative Faceted Search via Multi-Task Preference Alignment in E-Commerce,0,online_same_domain_stream
2604.00626v1,pypdf,5029cca4e4682dc57e8cc0641c61b68c61223f1e,156587,cs.LG,A Survey of On-Policy Distillation for Large Language Models,0,online_same_domain_stream
2603.19710v1,pypdf,08607756e60cb80773e8b2fa0dabc9b4f56a553d,59043,cs.IR,AIGQ: An End-to-End Hybrid Generative Architecture for E-commerce Query Recommendation,0,online_same_domain_stream
2603.27766v1,pymupdf,528aa64b06e0d7af8160902760552497fcbb4207,43011,cs.LG,AutoStan: Autonomous Bayesian Model Improvement via Predictive Feedback,1,online_same_domain_stream
2603.28086v1,pymupdf,b8ee1c0dc659f4681381e6c0f7899fc7aea511bf,33456,cs.SD,MOSS-VoiceGenerator: Create Realistic Voices with Natural Language Descriptions,0,online_same_domain_stream
2603.24372v1,pymupdf,f2ce1d48d614dc9a1a59bfe115aab169fd599e96,50151,cs.CL,Improving Lean4 Autoformalization via Cycle Consistency Fine-tuning,1,online_same_domain_stream
2603.23301v1,pymupdf,687311120b5b1bd5716912296515ced84345c01e,85454,cs.CL,Steering LLMs for Culturally Localized Generation,1,online_same_domain_stream
2603.27451v1,pymupdf,6374688725a136a069fe820981acfdf66495df5c,36309,cs.CL,Multi-Agent Dialectical Refinement for Enhanced Argument Classification,1,online_same_domain_stream
2509.03696v1,pypdf,8f7b138f4de89c3cea80f6c547b838a11e9cc06d,22136,cs.IR,LLMs for estimating positional bias in logged interaction data,0,online_same_domain_stream
2603.24961v1,pymupdf,9f1a9ba1f75e8011f7c666146aa3f1d1f5c3f213,41727,cs.AI,Can MLLMs Read Students' Minds? Unpacking Multimodal Error Analysis in Handwritten Math,1,online_same_domain_stream
2603.27694v1,pymupdf,e8b23a3bf37caffd9146ca0732603eef4f678258,179303,cs.CL,Can Large Language Models Simulate Human Cognition Beyond Behavioral Imitation?,1,online_same_domain_stream
2601.03258v1,pypdf,129d9e2b8b4a028cca30cb3b1fff336df8cde786,9691,cs.IR,Enhancing Retrieval-Augmented Generation with Two-Stage Retrieval: FlashRank Reranking and Query Expansion,1,online_same_domain_stream
2603.23911v1,pypdf,e6e60ff87e517b3ab4c50db3c83caf60473e0b5d,66349,cs.CL,Self-Distillation for Multi-Token Prediction,0,online_same_domain_stream
2603.10332v1,pypdf,b012d8a86f5f2673a78ec85f67d764975a0f339b,46767,cs.IR,Does Reasoning Make Search More Fair? Comparing Fairness in Reasoning and Non-Reasoning Rerankers,1,online_same_domain_stream
2603.26587v1,pymupdf,952c3d5178da02a1913a0bd94d4e4107e6b5e599,21510,cs.CL,EnTaCs: Analyzing the Relationship Between Sentiment and Language Choice in English-Tamil Code-Switching,1,online_same_domain_stream
2604.00449v1,pypdf,711b258d014161821b03051c07c114701e105c69,96448,cs.LG,Convergence of Byzantine-Resilient Gradient Tracking via Probabilistic Edge Dropout,0,online_same_domain_stream
2603.25415v1,pymupdf,308098eefe377ebb9cb2519e733e923110b88136,72873,cs.AI,Modernising Reinforcement Learning-Based Navigation for Embodied Semantic Scene Graph Generation,1,online_same_domain_stream
2603.27982v2,pymupdf,c878e23874536b658bd0542ba073ac7aa4d79360,64169,cs.CV,CDH-Bench: A Commonsense-Driven Hallucination Benchmark for Evaluating Visual Fidelity in Vision-Language Models,0,online_same_domain_stream
2603.02999v3,pymupdf,a3d7d68b264ef9ea2031585b23dca7f015a496df,52327,cs.IR,OneRanker: Unified Generation and Ranking with One Model in Industrial Advertising Recommendation,0,online_same_domain_stream
2604.00324v1,pypdf,a7d3676135086183616f967a81d565a02b5362d1,317547,cs.LG,The Persistent Vulnerability of Aligned AI Systems,0,online_same_domain_stream
2603.28263v1,pypdf,c7e2ada6ffdc1aa9a67a67aa0fcb5dba163f3dee,73099,cs.CL,Merge and Conquer: Instructing Multilingual Models by Adding Target Language Weights,0,online_same_domain_stream
2603.26064v1,pymupdf,64dcffd3a513ca1d82928e37cb1e8f0f67ea6fe6,56401,cs.CV,MuDD: A Multimodal Deception Detection Dataset and GSR-Guided Progressive Distillation for Non-Contact Deception Detection,1,online_same_domain_stream
2603.23404v1,pymupdf,112dbf9706dd8b3dfdd95d982e00588d42c6c6f2,85469,cs.CV,Unleashing Spatial Reasoning in Multimodal Large Language Models via Textual Representation Guided Reasoning,0,online_same_domain_stream
2603.29345v1,pypdf,000a503e73e3a99c9ab3a11578b3a2aac4daa546,67080,cs.CL,Open Machine Translation for Esperanto,1,online_same_domain_stream
2603.24073v1,pymupdf,54788fb5b3f857e3ff1a81306ddb2d12c9716e2e,47270,cs.CL,ConceptKT: A Benchmark for Concept-Level Deficiency Prediction in Knowledge Tracing,1,online_same_domain_stream
