doc_id,parser_name,text_sha1,char_count,primary_category,title,label,stream_type
2603.25620v1,pymupdf,207467ff1f24eba8e94ba25ec8e22030cd286aa7,69092,cs.CL,PICon: A Multi-Turn Interrogation Framework for Evaluating Persona Agent Consistency,1,online_same_domain_stream
2603.29654v1,pymupdf,f297351295bff8ea21af1d8a325c3488e16fd2b9,69501,cs.LG,Concept frustration: Aligning human concepts and machine representations,0,online_same_domain_stream
2604.00053v1,pypdf,05f02f068009f83e13957b595e9d4449ba6e583d,58594,cs.SE,The Energy Footprint of LLM-Based Environmental Analysis: LLMs and Domain Products,0,online_same_domain_stream
2603.26140v1,pymupdf,43cc3ec45183f8739242feeabd1b1164cff9e92a,29135,cs.LG,On the Complexity of Optimal Graph Rewiring for Oversmoothing and Oversquashing in Graph Neural Networks,0,online_same_domain_stream
2603.28038v1,pypdf,457b2c1ce9627c2be13645e7cb1608d695f878ff,33827,cs.AI,Beyond the Answer: Decoding the Behavior of LLMs as Scientific Reasoners,0,online_same_domain_stream
2604.00493v1,pypdf,b60bd2acd4ecbdc30f40dcd600af50fb19ad862d,109564,cs.CV,A Reasoning-Enabled Vision-Language Foundation Model for Chest X-ray Interpretation,1,online_same_domain_stream
2603.29247v1,pypdf,feeb0d2817f0b537f69cdcb32acec4ed09d30efa,56970,cs.CL,MemRerank: Preference Memory for Personalized Product Reranking,0,online_same_domain_stream
2602.15921v1,pymupdf,ccc992322226f2929e2d00a4c3da1c806b7f53b4,31226,cs.DS,Latent Objective Induction and Diversity-Constrained Selection: Algorithms for Multi-Locale Retrieval Pipelines,1,online_same_domain_stream
2602.16136v1,pymupdf,7ac189b701f25a7ae425f58d3b61ebf912892523,25086,cs.IR,Retrieval Collapses When AI Pollutes the Web,1,online_same_domain_stream
2603.28943v1,pymupdf,d8da8dbc72dc16a37a023bbb244bbdb02c2eb272,40805,cs.LG,Differentiable Initialization-Accelerated CPU-GPU Hybrid Combinatorial Scheduling,1,online_same_domain_stream
2603.28573v1,pymupdf,517454a5592868c9643dd08834619d410a6fc13e,39977,cs.LG,Learning Partial Action Replacement in Offline MARL,1,online_same_domain_stream
2603.26211v1,pypdf,3472b932563830f7b2cae69bdf75c34e6d8c028a,57736,cs.CV,Towards GUI Agents: Vision-Language Diffusion Models for GUI Grounding,0,online_same_domain_stream
2603.24372v1,pypdf,a6a8af756375108fb8ad74a9168d17f4512b560f,49810,cs.CL,Improving Lean4 Autoformalization via Cycle Consistency Fine-tuning,0,online_same_domain_stream
2602.07778v1,pypdf,b558831addcee520a2d6778725a61d6b1994d617,64761,cs.CL,Attn-GS: Attention-Guided Context Compression for Efficient Personalized LLMs,0,online_same_domain_stream
2604.00715v1,pymupdf,1b2eee6a1c4906567c6e3ee8261af2d32ca4dbc7,68477,cs.CL,To Memorize or to Retrieve: Scaling Laws for RAG-Considerate Pretraining,0,online_same_domain_stream
2603.25836v1,pypdf,85492e2268fd380ab5182c5554ef392cebac25b6,29055,cs.CL,Gradient-Informed Training for Low-Resource Multilingual Speech Translation,0,online_same_domain_stream
2603.27027v1,pypdf,0ff68f1378ea361cbe17937494faea41fe25fb92,48965,cs.CL,TAPS: Task Aware Proposal Distributions for Speculative Sampling,0,online_same_domain_stream
2603.22510v1,pymupdf,5cae750acd6b99346380641f906fcd219c590e9e,46597,cs.DL,Do Large Language Models Reduce Research Novelty? Evidence from Information Systems Journals,0,online_same_domain_stream
2603.21696v1,pypdf,b62357b65e67a9c39546f31af08a39f81f8ca379,46841,cs.AI,MIND: Multi-agent inference for negotiation dialogue in travel planning,0,online_same_domain_stream
2604.00799v1,pymupdf,11f9b5afa469e079df15d97a1730fd0e5da6e8c4,60919,cs.CV,Multimodal Language Models Cannot Spot Spatial Inconsistencies,1,online_same_domain_stream
2603.25333v1,pypdf,7d899c7b0c581b771506711f587163f2a1efe628,49318,cs.CL,Adaptive Chunking: Optimizing Chunking-Method Selection for RAG,1,online_same_domain_stream
2604.00920v1,pymupdf,6c2dcbe3e31738356a6df4cf5ba21f40cd9a2076,52869,cs.CL,"GPT-NL Public Corpus: A Permissively Licensed, Dutch-First Dataset for LLM Pre-training",0,online_same_domain_stream
2509.17066v1,pypdf,9ea494e5f20cab4be3bf23c4187107839b0f0cab,22398,cs.AI,RALLM-POI: Retrieval-Augmented LLM for Zero-shot Next POI Recommendation with Geographical Reranking,0,online_same_domain_stream
2603.17714v1,pymupdf,df98eacb29c88f0a7121043f372cab0eafd9c764,117428,cs.AI,From Virtual Environments to Real-World Trials: Emerging Trends in Autonomous Driving,0,online_same_domain_stream
2604.00500v1,pymupdf,ed493fc0ad20208b8283e3bd326f9fbfaa5d978b,43822,cs.IR,Evidence Units: Ontology-Grounded Document Organization for Parser-Independent Retrieval,0,online_same_domain_stream
2603.25464v1,pymupdf,bafd7a65d5d7700764eebc2f0cf69b9761aee86b,58456,cs.LG,Maximum Entropy Behavior Exploration for Sim2Real Zero-Shot Reinforcement Learning,0,online_same_domain_stream
2604.01081v1,pymupdf,844ec0023d47cbe69b04b410da645830d404fa8a,80840,cs.CV,ProOOD: Prototype-Guided Out-of-Distribution 3D Occupancy Prediction,0,online_same_domain_stream
2603.29467v1,pymupdf,ce33a5fc08be6a2df15654e8b8d8f95fbcce6d52,24657,cs.CL,M-MiniGPT4: Multilingual VLLM Alignment via Translated Data,0,online_same_domain_stream
2603.29149v1,pypdf,597e78d9d1e14c8a29aade922e45a68d7486e97b,30369,cs.AI,Knowledge database development by large language models for countermeasures against viruses and marine toxins,1,online_same_domain_stream
2603.20309v1,pymupdf,0cebae2cda034e48d866c881d1568627bf5facb1,86429,cs.IR,BubbleRAG: Evidence-Driven Retrieval-Augmented Generation for Black-Box Knowledge Graphs,0,online_same_domain_stream
2603.04532v1,pypdf,040c3a6de3a551fe2473b1b0e77b16a06dfec6c6,38031,cs.IR,Still Fresh? Evaluating Temporal Drift in Retrieval Benchmarks,0,online_same_domain_stream
2603.27410v1,pypdf,bedb32cb08a2e9df30dd8f0b1a6b2adc134da5c5,66671,q-bio.NC,Grounding Social Perception in Intuitive Physics,0,online_same_domain_stream
2603.16673v2,pypdf,566156b72823fd3ab410687ff85104736cc2fc45,44622,cs.RO,When Should a Robot Think? Resource-Aware Reasoning via Reinforcement Learning for Embodied Robotic Decision-Making,0,online_same_domain_stream
2602.23075v1,pymupdf,b23541fb031fce1c8b396ed13dbbf11c9177ded9,21121,cs.CL,CiteLLM: An Agentic Platform for Trustworthy Scientific Reference Discovery,1,online_same_domain_stream
2604.00485v1,pypdf,ae10bdeeb080dff4a306c53ea0a83636cee63d66,79751,cs.LG,The Rashomon Effect for Visualizing High-Dimensional Data,0,online_same_domain_stream
2604.00249v1,pypdf,8041b1742f34f08c37a8acf6647ab26f2d08e9fb,28754,cs.AI,A Safety-Aware Role-Orchestrated Multi-Agent LLM Framework for Behavioral Health Communication Simulation,0,online_same_domain_stream
2604.00132v1,pymupdf,1d12e5eda5ea0668b30c621f2be65538c14731f7,29541,cs.LG,Predicting Wave Reflection and Transmission in Heterogeneous Media via Fourier Operator-Based Transformer Modeling,0,online_same_domain_stream
2603.27593v1,pymupdf,86cc1228e8298948df649eda7cb2c9d6d0aca3ce,104280,cs.CV,STRIDE: When to Speak Meets Sequence Denoising for Streaming Video Understanding,0,online_same_domain_stream
2603.21692v1,pypdf,3b8e55b70be4d52c05cb5de1c626d6e515ba2431,32134,cs.AI,Reasoning Provenance for Autonomous AI Agents: Structured Behavioral Analytics Beyond State Checkpoints and Execution Traces,0,online_same_domain_stream
2603.27356v1,pymupdf,f617d2f153b917f957850da5cb9a7b6575acbcfc,40664,cs.CL,Culturally Adaptive Explainable LLM Assessment for Multilingual Information Disorder: A Human-in-the-Loop Approach,1,online_same_domain_stream
2603.29689v1,pypdf,bea4f72f2b9b61ae19421c127497a16476c9dbfc,83254,cs.HC,KEditVis: A Visual Analytics System for Knowledge Editing of Large Language Models,0,online_same_domain_stream
2603.26137v1,pypdf,221400c3561b95fae21aee1bd14959721e93e4b7,34749,cs.SE,ATime-Consistent Benchmark for Repository-Level Software Engineering Evaluation,0,online_same_domain_stream
2603.25158v3,pymupdf,e74207ab71b3fd8043606eac0185d0679d070257,70343,cs.AI,Trace2Skill: Distill Trajectory-Local Lessons into Transferable Agent Skills,0,online_same_domain_stream
2604.00795v1,pypdf,d871130e21903806b0b352e5c49a99f870fc0cec,33988,cs.AI,Preference Guided Iterated Pareto Referent Optimisation for Accessible Route Planning,1,online_same_domain_stream
2604.00942v1,pymupdf,bf423273352d00fd48e9a4b1dbfcfdb9e697136c,102877,cs.LG,Differentially Private Manifold Denoising,1,online_same_domain_stream
2603.27296v1,pymupdf,0aff20d65b72b959922f709e55cf0ab030f6c48d,54190,cs.SE,A Multi-agent AI System for Deep Learning Model Migration from TensorFlow to JAX,0,online_same_domain_stream
2603.26771v1,pymupdf,1b37d2180235f85a399ea28f92dc4cbc7bcc08f9,16012,cs.CL,LogicDiff: Logic-Guided Denoising Improves Reasoning in Masked Diffusion Language Models,0,online_same_domain_stream
2603.29689v1,pymupdf,22d5e9fac5b564885531e03756168a9b36baa314,83236,cs.HC,KEditVis: A Visual Analytics System for Knowledge Editing of Large Language Models,1,online_same_domain_stream
2603.27233v1,pypdf,ddb7cd5dd5f71c959ec8561f602f77e9815ff036,40747,cs.CL,Structural Stress and Learned Helplessness in Afghanistan: A Multi-Layer Analysis of the AFSTRESS Dari Corpus,0,online_same_domain_stream
2604.00003v1,pypdf,dbe3f33d1daddaac47ab0a68363c9d62fd21f580,33094,cs.CL,A Reliability Evaluation of Hybrid Deterministic-LLM Based Approaches for Academic Course Registration PDF Information Extraction,0,online_same_domain_stream
2602.13830v1,pypdf,523962cfd1d0fa2982c8e2167e37d643ae6ec6ba,102456,cs.IR,A Tale of Two Graphs: Separating Knowledge Exploration from Outline Structure for Open-Ended Deep Research,0,online_same_domain_stream
2603.27817v1,pypdf,943bcaee7a309f8479384665f0a127921a9ebb1b,94171,cs.CV,Towards Context-Aware Image Anonymization with Multi-Agent Reasoning,0,online_same_domain_stream
2601.10644v1,pypdf,939bbe8a8e406bb28e4caae1fed77355d5f99d2b,44782,cs.IR,RoutIR: Fast Serving of Retrieval Pipelines for Retrieval-Augmented Generation,0,online_same_domain_stream
2603.29846v1,pypdf,ef80bc3302f68a1b686fb2fe93cdcdf2bc74f888,60730,cs.CL,SNEAK: Evaluating Strategic Communication and Information Leakage in Large Language Models,0,online_same_domain_stream
2603.21440v3,pymupdf,ce3f765e98eaf8de8a64ec29b2f2909a1769d141,42391,cs.CL,KG-Hopper: Empowering Compact Open LLMs with Knowledge Graph Reasoning via Reinforcement Learning,0,online_same_domain_stream
2510.24402v1,pypdf,8bb85a933bdedf89abe71d5842ecaec6861492a7,90064,cs.IR,Metadata-Driven Retrieval-Augmented Generation for Financial Question Answering,1,online_same_domain_stream
2604.00716v1,pymupdf,0d59ee9651c1d465a91bb8f82a1ac98265fa8b34,31766,cs.AI,CircuitProbe: Predicting Reasoning Circuits in Transformers via Stability Zone Detection,0,online_same_domain_stream
2603.13725v1,pypdf,645786edb20ae1d0dafa22f9edafe6d15fa6afa3,40003,cs.CL,Can We Trust LLMs on Memristors? Diving into Reasoning Ability under Non-Ideality,0,online_same_domain_stream
2604.01215v1,pypdf,f34aa9c4d249bc0a78cc5d2ab13b6a6fcfac3927,178433,cs.LG,The Recipe Matters More Than the Kitchen:Mathematical Foundations of the AI Weather Prediction Pipeline,0,online_same_domain_stream
2512.22838v1,pypdf,52ce2cc799e95f3ccbfe4d564495bac6843b38e8,79785,cs.DB,OrchANN: A Unified I/O Orchestration Framework for Skewed Out-of-Core Vector Search,1,online_same_domain_stream
2601.19350v1,pymupdf,217ceab85e73223f6cee670fb5392b56b67e7511,66393,cs.CL,Cross-Examination Framework: A Task-Agnostic Diagnostic for Information Fidelity in Text-to-Text Generation,1,online_same_domain_stream
2603.29871v1,pypdf,9036b0d8b44050de1dbd10bdbb9eaf55d07e3aa4,72772,cs.AI,ShapE-GRPO: Shapley-Enhanced Reward Allocation for Multi-Candidate LLM Training,0,online_same_domain_stream
2601.13918v1,pymupdf,b00bf67c5a7bdc1ca901c6ac21c5b07ac34fd548,118768,cs.CL,AgentEHR: Advancing Autonomous Clinical Decision-Making via Retrospective Summarization,0,online_same_domain_stream
2603.25100v1,pypdf,bc121f6fdb5e8eb61bb3ab65b44b94c37ee5df3c,681628,cs.MA,From Logic Monopoly to Social Contract: Separation of Power and the Institutional Foundations for Autonomous Agent Economies,0,online_same_domain_stream
2603.28108v1,pypdf,1816f940ff422ce5ff3f4b009d5011e4ab509752,44318,cs.DL,Quid est VERITAS? A Modular Framework for Archival Document Analysis,0,online_same_domain_stream
2603.26639v1,pymupdf,02e0962fd47da46e94b694210cf43a03ed254213,64600,cs.CV,Make Geometry Matter for Spatial Reasoning,1,online_same_domain_stream
2603.12824v1,pypdf,0ddf588b1531a36d57b65d56f0fb546caf8fba53,57924,cs.IR,NanoVDR: Distilling a 2B Vision-Language Retriever into a 70M Text-Only Encoder for Visual Document Retrieval,0,online_same_domain_stream
2603.14170v1,pypdf,670ef7daabc421804989961ade411c56e7afe2d9,64341,cs.IR,"Citation-Enforced RAG for Fiscal Document Intelligence: Cited, Explainable Knowledge Retrieval in Tax Compliance",0,online_same_domain_stream
2603.26831v1,pypdf,56932877e2e80e4f46f908b276a6154d9402e3d3,87827,cs.CV,Envisioning global urban development with satellite imagery and generative AI,0,online_same_domain_stream
2603.26964v1,pypdf,8c338d66834767bfa247fb31cf05b9f5d8b20c3a,8387,cs.CG,Neural Approximation of Generalized Voronoi Diagrams,0,online_same_domain_stream
2603.20179v2,pypdf,5915f2b6b8cb3f69b4ceff4604030747e03a20c0,924182,hep-ex,AI Agents Can Already Autonomously Perform Experimental High Energy Physics,0,online_same_domain_stream
2603.29194v1,pymupdf,3bc35c8729005fb82d58ce0dfa5b339d20df37ee,35341,cs.CV,Multi-Layered Memory Architectures for LLM Agents: An Experimental Evaluation of Long-Term Context Retention,0,online_same_domain_stream
2603.27119v1,pypdf,15f5677b3a1f5722484e4477c1eda652ac755a66,40837,cs.LG,Bayesian-Symbolic Integration for Uncertainty-Aware Parking Prediction,0,online_same_domain_stream
2603.25374v1,pymupdf,4138f486270e1072e9dc6c836f1accbc95f82e6f,15793,cs.IR,Supercharging Federated Intelligence Retrieval,1,online_same_domain_stream
2603.29315v1,pypdf,e112ab71515982600853339faf114b93e3ad8e2a,47285,cs.RO,IMPASTO: Integrating Model-Based Planning with Learned Dynamics Models for Robotic Oil Painting Reproduction,1,online_same_domain_stream
2603.21437v1,pypdf,317d94ad28656e98e3c5b182241eaffc5e7c7223,101786,cs.CL,Semantic Shift: the Fundamental Challenge in Text Embedding and Retrieval,0,online_same_domain_stream
2604.00865v1,pymupdf,3622b64bc5e1ba98cd90a5271d4e74e312653507,62070,cs.IR,Doctor-RAG: Failure-Aware Repair for Agentic Retrieval-Augmented Generation,1,online_same_domain_stream
2603.23508v1,pymupdf,8605ce870abc8e6a87c1f5b1a1215b3848e08b2c,34428,cs.CL,Fast and Faithful: Real-Time Verification for Long-Document Retrieval-Augmented Generation Systems,0,online_same_domain_stream
2603.29500v1,pymupdf,03da75b9f5a6ac71e0d0a83f37364b9bf67864dc,72056,cs.AI,Learning to Generate Formally Verifiable Step-by-Step Logic Reasoning via Structured Formal Intermediaries,1,online_same_domain_stream
2603.16777v1,pypdf,95e8ea04aa54239e786a409b57cf054461ba36d6,49236,cs.AI,Anticipatory Planning for Multimodal AI Agents,0,online_same_domain_stream
2603.20278v1,pypdf,aedc87f7b549937ef157304456696ffcd415d13e,103630,cs.IR,OpenResearcher: A Fully Open Pipeline for Long-Horizon Deep Research Trajectory Synthesis,0,online_same_domain_stream
2603.29632v1,pymupdf,cfb3e017aff28fd354dfd2a92d1ba11c42425f27,31153,cs.MA,An Empirical Study of Multi-Agent Collaboration for Automated Research,0,online_same_domain_stream
2602.16124v1,pypdf,e5311509b7cae386ef1e7d64b44301f56381ad20,72436,cs.IR,Rethinking ANN-based Retrieval: Multifaceted Learnable Index for Large-scale Recommendation System,1,online_same_domain_stream
2604.00319v1,pypdf,65d8384820978c3133a63509efd1895facf95ae7,88514,cs.AI,Collaborative AI Agents and Critics for Fault Detection and Cause Analysis in Network Telemetry,1,online_same_domain_stream
2603.25926v1,pymupdf,079cde7803eea960002a430acde363fa36072a20,35503,cs.CL,Density-aware Soft Context Compression with Semi-Dynamic Compression Ratio,0,online_same_domain_stream
2512.13001v1,pypdf,a8f866049a39a302ab72ccd753e83998fabd5341,39242,cs.IR,Are Large Language Models Really Effective for Training-Free Cold-Start Recommendation?,0,online_same_domain_stream
2603.20063v1,pypdf,488baab0374383c19da9af1d4ddbceccb6381013,48355,cs.LG,Fine-tuning Timeseries Predictors Using Reinforcement Learning,1,online_same_domain_stream
2603.27998v1,pypdf,10ecae3a8569bead9980a3a2cea60cb1a6d38167,31454,eess.AS,BiFormer3D: Grid-Free Time-Domain Reconstruction of Head-Related Impulse Responses with a Spatially Encoded Transformer,0,online_same_domain_stream
2603.26982v1,pypdf,085fc6a48b947f19ca1380eb34c822980e407830,24269,stat.ML,Online Statistical Inference of Constant Sample-averaged Q-Learning,0,online_same_domain_stream
2603.06982v1,pypdf,a5cb2be0e20f57ccdb3f9ee1b4ddb7a73e6c20c1,54840,cs.CV,Optimizing Multi-Modal Models for Image-Based Shape Retrieval: The Role of Pre-Alignment and Hard Contrastive Learning,1,online_same_domain_stream
2604.00491v1,pypdf,fcb832b9d684790b8d025f902f2599466f04a8f1,64296,cs.PL,Executing as You Generate: Hiding Execution Latency in LLM Code Generation,0,online_same_domain_stream
2603.23146v1,pymupdf,a38f2d92e1ee409f5e0c3459416b930dcd95fad7,67946,cs.CL,Why AI-Generated Text Detection Fails: Evidence from Explainable AI Beyond Benchmark Accuracy,0,online_same_domain_stream
2601.11762v1,pymupdf,5582068f947e1271bf088af20abad9121d0b1d82,54234,cs.CL,Industry-Aligned Granular Topic Modeling,1,online_same_domain_stream
2604.00901v1,pymupdf,ada57d3ba7edb8bbad7fc1dc9e8955ed15ec8fd1,91560,cs.AI,Experience as a Compass: Multi-agent RAG with Evolving Orchestration and Agent Prompts,0,online_same_domain_stream
2603.22779v2,pymupdf,e64a48bb475c1cf6d709f99b9b2bd520fcb63228,24176,cs.IR,KARMA: Knowledge-Action Regularized Multimodal Alignment for Personalized Search at Taobao,0,online_same_domain_stream
2601.12154v1,pypdf,de09df6e2ea5505872d6ce8f5d88dcd6d177cb6f,76726,cs.CL,Analyzing Cancer Patients' Experiences with Embedding-based Topic Modeling and LLMs,0,online_same_domain_stream
2510.22215v1,pymupdf,ce0ec9ebcba780a24668565d1da626b11730c9d6,56956,cs.IR,Hybrid-Vector Retrieval for Visually Rich Documents: Combining Single-Vector Efficiency and Multi-Vector Accuracy,0,online_same_domain_stream
2602.00459v1,pypdf,30b0ec48310ce18bd11577231c2a4fcf3f7b956c,81145,cs.CL,What Matters to an LLM? Behavioral and Computational Evidences from Summarization,1,online_same_domain_stream
2603.27451v1,pypdf,0a5455a9bf077627ba2036642ec2575132f4d711,35984,cs.CL,Multi-Agent Dialectical Refinement for Enhanced Argument Classification,0,online_same_domain_stream
2603.21886v1,pypdf,2e0a59d9ac8c25e7f8858f3b574708fca53e0434,30805,cs.IR,ADaFuSE: Adaptive Diffusion-generated Image and Text Fusion for Interactive Text-to-Image Retrieval,0,online_same_domain_stream
2603.19585v1,pymupdf,4ab06191a680e63a90c9afe395762fe5ea3be768,49653,cs.IR,SaFRO: Satisfaction-Aware Fusion via Dual-Relative Policy Optimization for Short-Video Search,1,online_same_domain_stream
2604.00385v1,pypdf,ee811f89299f5df7f2de858bf370ca2bd2e11028,70220,cs.LG,GUIDE: Reinforcement Learning for Behavioral Action Support in Type 1 Diabetes,0,online_same_domain_stream
2601.14224v1,pypdf,79b099cec57e1adf3e3e32a303295e8fc486b1e1,39769,cs.IR,Rerank Before You Reason: Analyzing Reranking Tradeoffs through Effective Token Cost in Deep Search Agents,0,online_same_domain_stream
2604.00175v1,pymupdf,2043117a86b5b185a7ec681d27ca5002d99febc1,51386,cs.LG,Sit-to-Stand Transitions Detection and Duration Measurement Using Smart Lacelock Sensor,1,online_same_domain_stream
2603.27064v1,pymupdf,0cf11e44aec25e2f1a5b6e6a84565f28d294ece9,87338,cs.CV,"ChartNet: A Million-Scale, High-Quality Multimodal Dataset for Robust Chart Understanding",0,online_same_domain_stream
2601.05258v1,pypdf,aaec8b442876b63096901728ff826413034de57c,55120,cs.IR,From Events to Trending: A Multi-Stage Hotspots Detection Method Based on Generative Query Indexing,1,online_same_domain_stream
2603.28054v1,pypdf,c69e39db3eed7a263d8cf17bcd4033da2f713f57,73723,cs.CL,Who Wrote the Book? Detecting and Attributing LLM Ghostwriters,0,online_same_domain_stream
2603.21460v1,pypdf,85061e1e1ff0c91516ed933ee5c2378d9ddd6b55,38421,cs.IR,When Documents Disagree: Measuring Institutional Variation in Transplant Guidance with Retrieval-Augmented Language Models,0,online_same_domain_stream
2603.29492v1,pymupdf,073fa1bfaeca1b952cb1f9a8b94fc93dc070469f,30667,cs.CL,Calibrated Confidence Expression for Radiology Report Generation,1,online_same_domain_stream
2601.04073v1,pypdf,3529443fab5a42d0bb617815b1f2aa747bb32467,57330,cs.CV,Analyzing Reasoning Consistency in Large Multimodal Models under Cross-Modal Conflicts,1,online_same_domain_stream
2603.16330v1,pymupdf,17624b3fc7473894752c88dae6894ad39390e838,66034,cs.CV,An Interpretable Machine Learning Framework for Non-Small Cell Lung Cancer Drug Response Analysis,0,online_same_domain_stream
2603.16648v1,pymupdf,f8ec038034d69ce08f5bb7871a1dfb22ed24d257,59293,cs.AI,Domain-Independent Dynamic Programming with Constraint Propagation,0,online_same_domain_stream
2603.29846v1,pymupdf,b8e9c33ceb281bee07da32ea1e1fe794c5f6c896,60939,cs.CL,SNEAK: Evaluating Strategic Communication and Information Leakage in Large Language Models,1,online_same_domain_stream
2603.25640v1,pymupdf,4d0038bbec57922d561bf1afef634e1f8a239d79,34883,cs.DL,RenoBench: A Citation Parsing Benchmark,0,online_same_domain_stream
2603.22231v1,pypdf,52d35a622a6cb90f40bbd7fcc8d3be74c1656895,78323,cs.IR,"One Model, Two Markets: Bid-Aware Generative Recommendation",0,online_same_domain_stream
2602.02290v2,pymupdf,f9086331e2540b9976ea4d64017babf642301184,34584,cs.CL,Hallucination or Creativity: How to Evaluate AI-Generated Scientific Stories?,0,online_same_domain_stream
2603.23679v1,pymupdf,2edbb0475b3006a46429e5795a761dfce60dae70,32754,cs.RO,Learning What Can Be Picked: Active Reachability Estimation for Efficient Robotic Fruit Harvesting,0,online_same_domain_stream
2603.27522v1,pypdf,caed1cb11c9826d0de93c3b9e793538b74a82041,92010,cs.CL,Hidden Ads: Behavior Triggered Semantic Backdoors for Advertisement Injection in Vision Language Models,1,online_same_domain_stream
2603.10765v1,pymupdf,abc696f50a3245ffa582446a2e12373222e77532,103603,cs.PF,RAGPerf: An End-to-End Benchmarking Framework for Retrieval-Augmented Generation Systems,0,online_same_domain_stream
2603.29812v1,pymupdf,cd03013dbf7830e0c1e4b3faaa37a76f713d6c38,73859,cs.LG,AMShortcut: An Inference- and Training-Efficient Inverse Design Model for Amorphous Materials,0,online_same_domain_stream
2603.04836v1,pymupdf,2acfc3fed0e1de81f8ee1ebf10c75300b3f10150,25700,cs.IR,Beyond Text: Aligning Vision and Language for Multimodal E-Commerce Retrieval,0,online_same_domain_stream
2602.17518v1,pymupdf,690fadd812828c13b2c2d103aa420266f68c617d,45999,cs.IR,A Picture of Agentic Search,0,online_same_domain_stream
2603.14756v1,pypdf,0cc4c2ad26d5996785ffbc42a52e70419a01bc89,85826,cs.CL,Towards Privacy-Preserving Machine Translation at the Inference Stage: A New Task and Benchmark,0,online_same_domain_stream
2603.28533v1,pymupdf,f0a7a7efd6d67a0444ef1eed0c55e0310fac9132,95245,cs.CL,GraphWalker: Agentic Knowledge Graph Question Answering via Synthetic Trajectory Curriculum,0,online_same_domain_stream
2603.20513v1,pypdf,ee0c555871572f6d6bb1da2a485132c8d318207d,41107,cs.IR,ReBOL: Retrieval via Bayesian Optimization with Batched LLM Relevance Observations and Query Reformulation,0,online_same_domain_stream
2603.25126v1,pymupdf,6311872b79f91beb4a3749fe81222304a3f192c2,68177,cs.IR,MCLMR: A Model-Agnostic Causal Learning Framework for Multi-Behavior Recommendation,1,online_same_domain_stream
2603.29756v1,pymupdf,ab9636a8c8a7ef1253fca38e82a3950363e23147,113400,cs.LG,One-for-All: A Lightweight Stabilized and Parameter-Efficient Pre-trained LLM for Time Series Forecasting,1,online_same_domain_stream
2602.23342v1,pypdf,363a3d208e1c49e60d0f5d01edb4f15063b0d2f0,89380,cs.DB,AlayaLaser: Efficient Index Layout and Search Strategy for Large-scale High-dimensional Vector Similarity Search,0,online_same_domain_stream
2603.23172v1,pymupdf,e9859d6b4f55064198eed6afa6f243c44557b01c,42894,cs.CL,From Synthetic to Native: Benchmarking Multilingual Intent Classification in Logistics Customer Service,0,online_same_domain_stream
2603.13997v1,pypdf,2a091b55c4b2031d98443f3554e12adb29a5cf48,52125,cs.IR,Location Aware Embedding for Geotargeting in Sponsored Search Advertising,0,online_same_domain_stream
2604.01197v1,pypdf,990dc6be1b49a427caceab7ee5d682a044c45366,108916,quant-ph,Learning and Generating Mixed States Prepared by Shallow Channel Circuits,1,online_same_domain_stream
2603.27958v1,pypdf,32d4a319449a851da23dbf8b6592a9705548cb4e,55831,cs.AI,CARV: A Diagnostic Benchmark for Compositional Analogical Reasoning in Multimodal LLMs,0,online_same_domain_stream
2603.10494v1,pymupdf,7485ae3f63f499333dc9350b21be871296c39791,46666,cs.CL,VERI-DPO: Evidence-Aware Alignment for Clinical Summarization via Claim Verification and Direct Preference Optimization,0,online_same_domain_stream
2604.00375v1,pypdf,eeca6d4ac769162f52cc585678d7dcad17f88ecb,73373,cs.CL,"Locally Confident, Globally Stuck: The Quality-Exploration Dilemma in Diffusion Language Models",0,online_same_domain_stream
2603.27358v1,pymupdf,fa820708acc20b7b4cda779419168d6dc69f62a6,25918,cs.CL,Not Worth Mentioning? A Pilot Study on Salient Proposition Annotation,1,online_same_domain_stream
2603.28900v1,pymupdf,1a66827efe5a315dd33f94ccbe232e8b59029a2a,39317,cs.RO,Robust Multi-Agent Reinforcement Learning for Small UAS Separation Assurance under GPS Degradation and Spoofing,0,online_same_domain_stream
2603.20286v1,pypdf,a8534a0b5f26115586355917faa327dc98617e0f,60004,cs.IR,Rethinking Retrieval-Augmentation as Synthesis: A Query-Aware Context Merging Approach,0,online_same_domain_stream
2603.27991v1,pypdf,2adebc920668b5b93593a6215db60576b054bd07,56671,cs.HC,ViviDoc: Generating Interactive Documents through Human-Agent Collaboration,0,online_same_domain_stream
2604.01168v1,pypdf,3f99859333b2e0719c5ac7d3ab9b522452863b18,42344,cs.CL,S0 Tuning: Zero-Overhead Adaptation of Hybrid Recurrent-Attention Models,0,online_same_domain_stream
