doc_id,parser_name,text_sha1,char_count,primary_category,title,label,stream_type
2604.00977v1,pypdf,5bd3ecacae1e2f004359ae6027a87486a1d24035,49999,cs.LG,Flow-based Policy With Distributional Reinforcement Learning in Trajectory Optimization,0,online_same_domain_stream
2604.00112v1,pypdf,097928da185b0933c0214d4c4ffe344bea6dc5b1,42736,cs.CR,Efficient Software Vulnerability Detection Using Transformer-based Models,0,online_same_domain_stream
2604.00731v1,pypdf,198ded00ddee3132b243047f0e907f90b293a872,42490,cs.IR,STCALIR: Semi-Synthetic Test Collection for Algerian Legal Information Retrieval,0,online_same_domain_stream
2604.00316v1,pypdf,e577423b954a505807374c97c82c3dda06b4b597,70908,stat.ML,Breaking Data Symmetry is Needed For Generalization in Feature Learning Kernels,0,online_same_domain_stream
2511.16528v1,pypdf,be65a528f27f46d4e4c978335fe7e10c04262165,34160,cs.CL,TurkColBERT: A Benchmark of Dense and Late-Interaction Models for Turkish Information Retrieval,0,online_same_domain_stream
2604.01073v1,pypdf,ab1fa704894564fc3909f71c7891684c9a8cdfa3,35180,cs.CL,Narrative Fingerprints: Multi-Scale Author Identification via Novelty Curve Dynamics,0,online_same_domain_stream
2603.29665v1,pypdf,ccb2db7a2e4dbaf9e72f18fded1753bfdb89e255,43747,cs.CL,Near-Miss: Latent Policy Failure Detection in Agentic Workflows,0,online_same_domain_stream
2603.29068v2,pymupdf,a005798153ccba81f774f09998ad6c9ab7cf2dc6,46757,cs.LG,ARCS: Autoregressive Circuit Synthesis with Topology-Aware Graph Attention and Spec Conditioning,0,online_same_domain_stream
2604.00754v1,pymupdf,fb2bfe75470d3a589317354a966dedf3c00e543b,47504,cs.CL,Stochastic Attention: Connectome-Inspired Randomized Routing for Expressive Linear-Time Attention,0,online_same_domain_stream
2603.24318v1,pymupdf,01ceeab6e2d5c3babfa595576fa21eb27a065d4e,271996,cs.RO,Toward Generalist Neural Motion Planners for Robotic Manipulators: Challenges and Opportunities,0,online_same_domain_stream
2603.24125v1,pypdf,acb1b942d0ccf9cce84f9a177e03f36835ff26d3,65398,cs.CL,Alignment Reduces Expressed but Not Encoded Gender Bias: A Unified Framework and Study,0,online_same_domain_stream
2603.25531v1,pymupdf,7a388c49319953054754de40b78805b84f20eb92,78530,cs.FL,Synchronous Signal Temporal Logic for Decidable Verification of Cyber-Physical Systems,0,online_same_domain_stream
2603.01590v1,pymupdf,b1237cfc8dfb61bd8ec3b67bc14b00209d384817,32463,cs.IR,IDProxy: Cold-Start CTR Prediction for Ads and Recommendation at Xiaohongshu with Multimodal LLMs,0,online_same_domain_stream
2602.16136v1,pypdf,cb6e4c38a3beb3c4dd182028b80dfbb813aabddb,25008,cs.IR,Retrieval Collapses When AI Pollutes the Web,0,online_same_domain_stream
2601.05200v3,pymupdf,31af728313779b92118e45cae7754480ae167ae6,49313,cs.IR,Multivector Reranking in the Era of Strong First-Stage Retrievers,0,online_same_domain_stream
2603.26246v1,pymupdf,64862d09dc8737cafbc3dcfa9f6feabefb0158aa,42987,cs.CL,Distilling Conversations: Abstract Compression of Conversational Audio Context for LLM-based ASR,0,online_same_domain_stream
2604.00865v1,pypdf,6ac16c52e2f9e0fb5cbbd71f8e46b6e6b0a2b1a9,61931,cs.IR,Doctor-RAG: Failure-Aware Repair for Agentic Retrieval-Augmented Generation,0,online_same_domain_stream
2602.23964v1,pypdf,8b922f6cd552b0a72e65036f85b2a3f7ecb8b132,27145,cs.IR,RAD-DPO: Robust Adaptive Denoising Direct Preference Optimization for Generative Retrieval in E-commerce,0,online_same_domain_stream
2603.29824v1,pypdf,45f78c0d1f70f32fd2dd3ab184e0a553c5c2d93a,62497,cs.LG,Curvature-Guided LoRA: Steering in the pretrained NTK subspace,0,online_same_domain_stream
2603.28963v1,pypdf,3cf0ad6bbdf89f2df506662e8aa87ced9c80bf94,75544,cs.RO,AutoWorld: Scaling Multi-Agent Traffic Simulation with Self-Supervised World Models,0,online_same_domain_stream
2603.24440v1,pypdf,1216d15a202a67030677a1ba669940f8effbd623,205293,cs.LG,CUA-Suite: Massive Human-annotated Video Demonstrations for Computer-Use Agents,0,online_same_domain_stream
2603.29149v1,pymupdf,c802054a5ef6fbda33264ec7b96f2d4fcf2eeca9,30979,cs.AI,Knowledge database development by large language models for countermeasures against viruses and marine toxins,0,online_same_domain_stream
2603.24396v1,pymupdf,53856f234c353823de5ee2c4ac6cc04a2d398bd6,51768,cs.IR,Exploring How Fair Model Representations Relate to Fair Recommendations,0,online_same_domain_stream
2603.26775v1,pypdf,43f796e5116a1b5829858b8282e94f938faa80a3,76895,cs.LG,Learning to Select Visual In-Context Demonstrations,0,online_same_domain_stream
2603.24580v1,pymupdf,b3af134fb86f967ee211684fe329fb575f2aa656,55226,cs.CL,Retrieval Improvements Do Not Guarantee Better Answers: A Study of RAG for AI Policy QA,0,online_same_domain_stream
2603.23938v1,pymupdf,4366edc52926a68a56ecfab1378a377c07ae60d9,82123,cs.CL,OmniACBench: A Benchmark for Evaluating Context-Grounded Acoustic Control in Omni-Modal Models,0,online_same_domain_stream
2603.12396v1,pymupdf,a47c596e50da6c2eff7560facc2bfed7941e1020,24517,cs.IR,Test-Time Strategies for More Efficient and Accurate Agentic RAG,0,online_same_domain_stream
2603.25415v1,pypdf,1ec0bafbd3ff5811eb625dc9ed3f9bb0cb68570d,72176,cs.AI,Modernising Reinforcement Learning-Based Navigation for Embodied Semantic Scene Graph Generation,0,online_same_domain_stream
2604.00801v1,pymupdf,418f7994ec21b069024585680ff6e18ae18a0e48,72864,cs.LG,Routing-Free Mixture-of-Experts,0,online_same_domain_stream
2603.24014v1,pypdf,f256485d2c5f6da9f92c596cd7ce8eaea495ef7d,76228,cs.AI,Language-Grounded Multi-Agent Planning for Personalized and Fair Participatory Urban Sensing,0,online_same_domain_stream
2603.16415v1,pypdf,715736fbab2eb09674d464355e09e7bd8efba2cc,44031,cs.CL,IndexRAG: Bridging Facts for Cross-Document Reasoning at Index Time,0,online_same_domain_stream
2603.09130v1,pymupdf,d7a1a64aed03772e7f2298a39c84a91ff9632fe5,76962,cs.SI,From Verification to Amplification: Auditing Reverse Image Search as Algorithmic Gatekeeping in Visual Misinformation Fact-checking,0,online_same_domain_stream
2508.13517v1,pypdf,ea9b5f0704807131486786b843ae6ff1a86acebe,50562,cs.IR,Heterogeneous Influence Maximization in User Recommendation,0,online_same_domain_stream
2602.12612v1,pymupdf,44f3b9a63ac96f2009be6886fb9d1639abd03d66,117480,cs.IR,Self-EvolveRec: Self-Evolving Recommender Systems with LLM-based Directional Feedback,0,online_same_domain_stream
2601.07765v1,pymupdf,1922425df40110810e9e7f94bd6db9d2d41836cf,79634,cs.CL,Contrastive Learning with Narrative Twins for Modeling Story Salience,0,online_same_domain_stream
2603.28618v1,pypdf,0fc0844ddb339d8adc9c12df6a72c5e259fb32bd,76778,cs.AI,Seeing with You: Perception-Reasoning Coevolution for Multimodal Reasoning,0,online_same_domain_stream
2601.05835v1,pypdf,97af84017ae66b756b0d8164169f5873a1399970,24710,cs.CL,"Left, Right, or Center? Evaluating LLM Framing in News Classification and Generation",0,online_same_domain_stream
2603.20034v1,pymupdf,0d0c41ba60a46220d13fa9ed8eeff03388e20be3,50652,cs.IR,CoverageBench: Evaluating Information Coverage across Tasks and Domains,0,online_same_domain_stream
2604.00362v1,pypdf,21e2ec4b52647b13f25765cf469b3133dfebc015,19482,cs.AI,In harmony with gpt-oss,0,online_same_domain_stream
2603.27524v1,pypdf,526f8a53fb69c208cdc988886d134a5cafc290c7,25743,cs.SE,"Safer Builders, Risky Maintainers: A Comparative Study of Breaking Changes in Human vs Agentic PRs",0,online_same_domain_stream
2601.06702v1,pypdf,8da5facaab7bfbde94fb42774fb2202009424e5f,46296,cs.CL,GRASP LoRA: GRPO Guided Adapter Sparsity Policy for Cross Lingual Transfer,0,online_same_domain_stream
2603.23849v1,pypdf,42017ed1083305ac03265f7639d0d370e38cdd3d,118560,cs.IR,VILLA: Versatile Information Retrieval From Scientific Literature Using Large LAnguage Models,0,online_same_domain_stream
2510.22670v1,pymupdf,00e5a72ef94e4cb9918ced281894b6e41e9f6b3d,65403,cs.IR,Tools are under-documented: Simple Document Expansion Boosts Tool Retrieval,0,online_same_domain_stream
2603.21152v3,pymupdf,f29a7f609c5c75713e378555aa04ccd0a034caf3,437319,physics.geo-ph,TRACE: A Multi-Agent System for Autonomous Physical Reasoning for Seismology,0,online_same_domain_stream
2603.20297v1,pypdf,0c96923fcd9a9a9270fe50ab7e4e26e1804fcbcc,31039,cs.LG,Transformer-Based Predictive Maintenance for Risk-Aware Instrument Calibration,0,online_same_domain_stream
2603.26186v1,pymupdf,98797c4aa311c0306eada15d239fbcbec351dec9,44263,cs.CV,Progressive Learning with Anatomical Priors for Reliable Left Atrial Scar Segmentation from Late Gadolinium Enhancement MRI,0,online_same_domain_stream
2604.00464v1,pypdf,6cfef658b4b5312e9d2ce74d3e3d6b8edc652bcb,94254,cs.HC,Not My Truce: Personality Differences in AI-Mediated Workplace Negotiation,0,online_same_domain_stream
2601.19350v1,pypdf,1402c2cf94f9a2b64a4dbc8692a255eadda655cd,66251,cs.CL,Cross-Examination Framework: A Task-Agnostic Diagnostic for Information Fidelity in Text-to-Text Generation,0,online_same_domain_stream
2511.14758v1,pymupdf,c2d212bacc9820412f9f7f501e411efd672c8b19,57717,cs.IR,"NeuCLIRBench: A Modern Evaluation Collection for Monolingual, Cross-Language, and Multilingual Information Retrieval",0,online_same_domain_stream
2603.00700v1,pymupdf,46763e343c3f1b812b6ce7296dec4214fecd60b9,31464,cs.IR,SODA: Semantic-Oriented Distributional Alignment for Generative Recommendation,0,online_same_domain_stream
2604.00508v1,pypdf,aca777071d1f19d154700a2ffe3d161d2efac164,127749,cs.LG,A Decoupled Basis-Vector-Driven Generative Framework for Dynamic Multi-Objective Optimization,0,online_same_domain_stream
2603.26557v1,pymupdf,30a54bf5abf5a629795c4808ecff199a25bff510,33713,cs.CL,MemBoost: A Memory-Boosted Framework for Cost-Aware LLM Inference,0,online_same_domain_stream
2602.14367v1,pypdf,0c847084779ae120ffd5923ff693f815afd014d5,184658,cs.CL,"InnoEval: On Research Idea Evaluation as a Knowledge-Grounded, Multi-Perspective Reasoning Problem",0,online_same_domain_stream
2603.25250v1,pypdf,f9b6dda1ec9630c28dee1544b911f5aa736d20c8,78722,cs.CV,Activation Matters: Test-time Activated Negative Labels for OOD Detection with Vision-Language Models,0,online_same_domain_stream
2603.21524v1,pymupdf,39851a81d23ce763acefbf0efdb724fd82cd0f80,47061,cs.CL,CatRAG: Functor-Guided Structural Debiasing with Retrieval Augmentation for Fair LLMs,0,online_same_domain_stream
2603.23937v1,pypdf,57572f25d4735048f91c3bb53606f849ae146b50,62722,cs.CL,Dialogue to Question Generation for Evidence-based Medical Guideline Agent Development,0,online_same_domain_stream
2601.03262v1,pymupdf,ea0458606da86d88fa755f33e9919de34ad2b1a0,82674,cs.IR,Roles of MLLMs in Visually Rich Document Retrieval for RAG: A Survey,0,online_same_domain_stream
2603.26098v1,pypdf,a1cd3d586aaae3f9d69f661d5d019f8518ab8fa3,28512,cs.SD,A Human-Inspired Decoupled Architecture for Efficient Audio Representation Learning,0,online_same_domain_stream
2601.04073v1,pymupdf,8bb10af89c94a671228020cd6769d8f4072d19b6,57496,cs.CV,Analyzing Reasoning Consistency in Large Multimodal Models under Cross-Modal Conflicts,0,online_same_domain_stream
2601.19535v1,pypdf,cf7ba756636ad8a291865d407ed9a157ed1a921a,48657,cs.IR,LURE-RAG: Lightweight Utility-driven Reranking for Efficient RAG,0,online_same_domain_stream
2602.20040v1,pypdf,3880d867e3ae0a052d658ce186cffc532d7996ce,81432,cs.CL,AgenticSum: An Agentic Inference-Time Framework for Faithful Clinical Text Summarization,0,online_same_domain_stream
2604.00987v1,pymupdf,6b230885431a3dcfb7cdf065eeed8b01430649fe,207696,stat.ML,Bridging Structured Knowledge and Data: A Unified Framework with Finance Applications,0,online_same_domain_stream
2602.03652v1,pymupdf,337bee2392e44fdcc7730330e72aaeb3384483da,65254,cs.CL,RAGTurk: Best Practices for Retrieval Augmented Generation in Turkish,0,online_same_domain_stream
2603.10332v1,pymupdf,d3be29f14b735c680555ed9833e8aec4ef2a76cb,47097,cs.IR,Does Reasoning Make Search More Fair? Comparing Fairness in Reasoning and Non-Reasoning Rerankers,0,online_same_domain_stream
2602.17674v1,pymupdf,a8bcb49d120ad75440c58190f946ce20bf2efe9b,178454,cs.HC,Lost Before Translation: Social Information Transmission and Survival in AI-AI Communication,0,online_same_domain_stream
2603.23271v1,pypdf,979ef25b005f86785dc07bdb8087b1e0dd87edc5,23843,cs.RO,A Multimodal Framework for Human-Multi-Agent Interaction,0,online_same_domain_stream
2603.29492v1,pypdf,9752cbf3c4c3127c502bdb5a975be8d9962e990d,30346,cs.CL,Calibrated Confidence Expression for Radiology Report Generation,0,online_same_domain_stream
2601.05258v1,pymupdf,bd77c4c1bfe7be8f1fd353abf5f070460d95c865,55196,cs.IR,From Events to Trending: A Multi-Stage Hotspots Detection Method Based on Generative Query Indexing,0,online_same_domain_stream
2604.00669v1,pypdf,b5a8e5c185bc27ca2704b470d81554c94c52d88d,51400,cs.LG,Embedded Variational Neural Stochastic Differential Equations for Learning Heterogeneous Dynamics,0,online_same_domain_stream
2603.00638v2,pymupdf,3308c20a106181b9985c5cb044685da1578e7df7,51480,cs.IR,RAIE: Region-Aware Incremental Preference Editing with LoRA for LLM-based Recommendation,0,online_same_domain_stream
2604.00803v1,pypdf,7c1e278d18750edeb23a6694354e119f370b8032,106600,cs.IR,A novel three-step approach to forecast firm-specific technology convergence opportunity via multi-dimensional feature fusion,0,online_same_domain_stream
2603.29148v1,pymupdf,08c4c9b8ccfe223e64447ddc92b40cb90b918ae2,82993,cs.LG,Efficient and Scalable Granular-ball Graph Coarsening Method for Large-scale Graph Node Classification,0,online_same_domain_stream
2603.25821v1,pymupdf,a1aab23f7f42bce5486786d31430689179824d52,77625,cs.CL,Doctorina MedBench: End-to-End Evaluation of Agent-Based Medical AI,0,online_same_domain_stream
2509.07485v2,pymupdf,0e20ea9e0254ff4b810d3165ddbb2960f097454e,53528,cs.IR,Multi-view-guided Passage Reranking with Large Language Models,0,online_same_domain_stream
2603.24054v1,pymupdf,d62940d6f02adc0220057f266a884d3a107ee876,33787,cs.DB,Hierarchical Spatial-Temporal Graph-Enhanced Model for Map-Matching,0,online_same_domain_stream
2603.20514v1,pypdf,17f89bf4cafaed56d2ec27a5e73396f56f2e4ca1,35484,cs.CL,Evaluating Large Language Models on Historical Health Crisis Knowledge in Resource-Limited Settings: A Hybrid Multi-Metric Study,0,online_same_domain_stream
2604.00069v1,pypdf,589910c01d81850d84dac7c6a0143bf35f6e77e1,199447,cs.LG,Perspective: Towards sustainable exploration of chemical spaces with machine learning,0,online_same_domain_stream
2603.28430v1,pymupdf,6aca4c1453e2102a55e1576ec158db68caee54f0,31493,cs.LG,IsoQuant: Hardware-Aligned SO(4) Isoclinic Rotations for LLM KV Cache Compression,0,online_same_domain_stream
2603.28342v1,pymupdf,c055798f15ca2f62a2af0bfe9abaf0b21e002fd6,60628,cs.CL,Kernel-Smith: A Unified Recipe for Evolutionary Kernel Optimization,0,online_same_domain_stream
2604.00455v1,pymupdf,d797dd01c8cb2833c7b342592230c898063e36da,70133,cs.CV,First Logit Boosting: Visual Grounding Method to Mitigate Object Hallucination in Large Vision-Language Models,0,online_same_domain_stream
2602.23978v1,pymupdf,36dcc244d1447380f45c840aaac4d91487d0f185,28545,cs.IR,Towards Efficient and Generalizable Retrieval: Adaptive Semantic Quantization and Residual Knowledge Transfer,0,online_same_domain_stream
2603.26100v1,pypdf,d94e72428ae3a19e3eba93fdb93536e42ae48008,19623,cs.IR,Rethinking Recommendation Paradigms: From Pipelines to Agentic Recommender Systems,0,online_same_domain_stream
2603.17312v1,pymupdf,204fe32a6ef1af2ea1ce55433c951a68c6e2b74e,68117,cs.CV,Recurrent Reasoning with Vision-Language Models for Estimating Long-Horizon Embodied Task Progress,0,online_same_domain_stream
2601.11846v1,pymupdf,554d8471c79602bed5b17e822927463a04b893a1,157186,cs.CL,The Third VoicePrivacy Challenge: Preserving Emotional Expressiveness and Linguistic Content in Voice Anonymization,0,online_same_domain_stream
2602.01885v1,pymupdf,f578626921c3d3c67d30674edbd649ba03fac687,72489,cs.CL,ES-MemEval: Benchmarking Conversational Agents on Personalized Long-Term Emotional Support,0,online_same_domain_stream
2604.00830v1,pymupdf,06bf0a63ca83ac82b453288ab8902467991811f6,57611,cs.LG,Learning to Learn-at-Test-Time: Language Agents with Learnable Adaptation Policies,0,online_same_domain_stream
2603.21376v2,pymupdf,6c726e6765163035e8f41d9cab56af242647a9d9,33216,cs.AI,A transformer architecture alteration to incentivise externalised reasoning,0,online_same_domain_stream
2603.21036v1,pymupdf,0f1c1c10b9a09556ede93382dabe7f0da7c6cc9c,15500,cs.CL,Left Behind: Cross-Lingual Transfer as a Bridge for Low-Resource Languages in Large Language Models,0,online_same_domain_stream
2604.01220v1,pymupdf,1387f3daf4cc3e12087dc09e0a0a5343f92c56c4,47235,cs.CL,Universal YOCO for Efficient Depth Scaling,0,online_same_domain_stream
2603.27971v2,pymupdf,1384e5127a5e1a2a7d5452c94830b33f1b3ee0a9,60377,cs.LG,Principal Prototype Analysis on Manifold for Interpretable Reinforcement Learning,0,online_same_domain_stream
2602.00805v1,pypdf,2c514e72c677b6c0baf43159f289f945adc57727,25011,cs.IR,Optimizing Retrieval Components for a Shared Backbone via Component-Wise Multi-Stage Training,0,online_same_domain_stream
2603.24389v1,pypdf,8522a559baf2053466b7a37e8aaa4e1f7a6defe5,41020,cs.CL,When AI Meets Early Childhood Education: Large Language Models as Assessment Teammates in Chinese Preschools,0,online_same_domain_stream
2603.23646v1,pypdf,2d0155fa4ddc0402aaf82119ababf7ab425f60dc,56472,cs.CL,Swiss-Bench SBP-002: A Frontier Model Comparison on Swiss Legal and Regulatory Tasks,0,online_same_domain_stream
2603.26664v1,pymupdf,245f3fbeb468ef77b23162eb6bdd59e748cd63f7,34378,cs.SE,Learning to Commit: Generating Organic Pull Requests via Online Repository Memory,0,online_same_domain_stream
2604.00890v1,pymupdf,c767f2f0ca686937bd93dd8a97fd3fa1e27ba2f5,53061,cs.AI,Beyond Symbolic Solving: Multi Chain-of-Thought Voting for Geometric Reasoning in Large Language Models,0,online_same_domain_stream
2603.28990v1,pypdf,b6268e27eb4651df565a01a2e35e7bf0a14d9997,40992,cs.AI,Drop the Hierarchy and Roles: How Self-Organizing LLM Agents Outperform Designed Structures,0,online_same_domain_stream
2603.26207v1,pypdf,f19fd7b7d100d527bac319441ddf8db00193334d,65814,cs.CL,Sparse Auto-Encoders and Holism about Large Language Models,0,online_same_domain_stream
2603.29148v1,pypdf,1b0fbf2f9cd6022e1861635a9879c10cdf1032c5,105147,cs.LG,Efficient and Scalable Granular-ball Graph Coarsening Method for Large-scale Graph Node Classification,1,online_same_domain_stream
2602.13165v2,pypdf,f5eee707eec650848eb5a334044fe94ce3ed340f,35344,cs.IR,Asynchronous Verified Semantic Caching for Tiered LLM Architectures,0,online_same_domain_stream
2603.27269v1,pypdf,991f8212ea7668bea57018f9593c45dd86bb035b,37711,quant-ph,From Foundation ECG Models to NISQ Learners: Distilling ECGFounder into a VQC Student,0,online_same_domain_stream
2603.29968v1,pymupdf,c3f1922f5815a5af09eabecd1a8a7b7ce566037c,30263,cs.CV,"Trimodal Deep Learning for Glioma Survival Prediction: A Feasibility Study Integrating Histopathology, Gene Expression, and MRI",0,online_same_domain_stream
2603.28809v1,pymupdf,c2f628d2f06ced5af32dfbd4d571a505830ecf82,84024,cs.DB,WAter: A Workload-Adaptive Knob Tuning System based on Workload Compression,0,online_same_domain_stream
2603.12056v2,pypdf,9aa2d1f0f5b384bee86addf93696e9a4f586744d,112817,cs.AI,XSkill: Continual Learning from Experience and Skills in Multimodal Agents,0,online_same_domain_stream
2603.22862v1,pypdf,b3a2a1566058f49e521961e3da43bfcfa20c5bd1,190235,cs.SE,The Evolution of Tool Use in LLM Agents: From Single-Tool Call to Multi-Tool Orchestration,0,online_same_domain_stream
2602.00857v1,pymupdf,78329c17dd2f756af6f3a2e856f4e1468d8d74f6,113424,cs.CL,Unifying Adversarial Robustness and Training Across Text Scoring Models,0,online_same_domain_stream
2604.00666v1,pypdf,7f35a8cdad243922a2bc1aa8d25b6a06263eebea,49411,cs.CL,TRIMS: Trajectory-Ranked Instruction Masked Supervision for Diffusion Language Models,0,online_same_domain_stream
2604.01212v1,pymupdf,0ab1364f927a3e07b27fcdc6c9e4ad98716605ae,51846,cs.CL,$\texttt{YC-Bench}$: Benchmarking AI Agents for Long-Term Planning and Consistent Execution,0,online_same_domain_stream
2603.28306v1,pypdf,ac3c8906a0bc7dbe8e0b88718c8d89d088b36ad4,188554,cs.HC,Self++: Co-Determined Agency for Human--AI Symbiosis in Extended Reality,0,online_same_domain_stream
2601.14004v3,pymupdf,437f80159c1b3359c6140f469edd0f714c2458ee,310624,cs.CL,"Locate, Steer, and Improve: A Practical Survey of Actionable Mechanistic Interpretability in Large Language Models",0,online_same_domain_stream
2603.26846v1,pymupdf,323a5a5ac18d6ed660064bb684d1620d639d4ff6,89536,cs.LG,"Stable Reasoning, Unstable Responses: Mitigating LLM Deception via Stability Asymmetry",0,online_same_domain_stream
2603.09891v1,pypdf,6ce94b961161781db152f5c2d9ceabdd704db1cb,76541,cs.IR,Overview of the TREC 2025 Retrieval Augmented Generation (RAG) Track,0,online_same_domain_stream
2603.10700v1,pymupdf,027b18e5ec7252e743995a5d3b6bd6c141caec06,68872,cs.IR,Structured Linked Data as a Memory Layer for Agent-Orchestrated Retrieval,0,online_same_domain_stream
2601.20623v1,pymupdf,b63d74133846e816791850a054bb139ed71d045f,58591,cs.IR,When Vision Meets Texts in Listwise Reranking,0,online_same_domain_stream
2603.24558v1,pymupdf,9c9e80c97afd95a20b64f59e9d4032deabf855c5,105434,cs.CV,LensWalk: Agentic Video Understanding by Planning How You See in Videos,0,online_same_domain_stream
2603.24621v1,pymupdf,5440ac0dfdf73c60e9429027ff9d0677dfe6ccb0,59098,cs.AI,ARC-AGI-3: A New Challenge for Frontier Agentic Intelligence,0,online_same_domain_stream
2603.24556v1,pymupdf,556e03902f3998a9b7d7314c1d47c99824e6fa34,34375,cs.IR,Evaluating Chunking Strategies For Retrieval-Augmented Generation in Oil and Gas Enterprise Documents,0,online_same_domain_stream
2603.28955v1,pypdf,34aba7fe2497782cc0bb31eae297498fc5cc6d52,29409,cs.AI,Enhancing Policy Learning with World-Action Model,0,online_same_domain_stream
2509.13626v2,pypdf,7bdc5c353adfb1d04bd79e221bff46fbe28b5fc2,82275,cs.IR,Mind the Gap: Aligning Knowledge Bases with User Needs to Enhance Mental Health Retrieval,0,online_same_domain_stream
2603.29369v1,pymupdf,68d60bd0c65c6e47b8d8827ff94a7e5a3f775410,59526,cs.AR,AP-DRL: A Synergistic Algorithm-Hardware Framework for Automatic Task Partitioning of Deep Reinforcement Learning on Versal ACAP,0,online_same_domain_stream
2509.19057v2,pypdf,144a21ff071177887c4b830bd6caa44db7dd7fe7,64129,cs.IR,RELATE: Relation Extraction in Biomedical Abstracts with LLMs and Ontology Constraints,0,online_same_domain_stream
2603.26587v1,pypdf,70dea40825461d69721403e150fc5a5d0caadf02,21310,cs.CL,EnTaCs: Analyzing the Relationship Between Sentiment and Language Choice in English-Tamil Code-Switching,0,online_same_domain_stream
2604.00803v1,pymupdf,4c3441b264f4a6896fbc86b3ff5da1f9e42688e0,106963,cs.IR,A novel three-step approach to forecast firm-specific technology convergence opportunity via multi-dimensional feature fusion,1,online_same_domain_stream
2604.00067v1,pypdf,2e36d886bfde3a0a8268c9591c2614678ad214d4,81707,cs.LG,Temporal Memory for Resource-Constrained Agents: Continual Learning via Stochastic Compress-Add-Smooth,0,online_same_domain_stream
2603.27277v1,pymupdf,2c3619311231e05c33cba22b88be70efc03f3918,45822,cs.SE,Codebase-Memory: Tree-Sitter-Based Knowledge Graphs for LLM Code Exploration via MCP,0,online_same_domain_stream
2602.14710v1,pymupdf,75478340f1516a8d5412f20dab47cbe9bb54d08d,44387,cs.IR,Orcheo: A Modular Full-Stack Platform for Conversational Search,0,online_same_domain_stream
2603.27806v1,pymupdf,7b73607654ce0d7dc94aa450d9f0d3ed03a493d3,42596,cs.CL,Understanding Teacher Revisions of Large Language Model-Generated Feedback,0,online_same_domain_stream
2509.14749v1,pymupdf,8c047d1f65571b59f8e09f79178f9ba7e997d3b8,63244,cs.CL,Evaluating Large Language Models for Cross-Lingual Retrieval,0,online_same_domain_stream
2603.28407v1,pypdf,3066d5dd928b45340432dae07cdbedfabbdbdc10,121825,cs.AI,MiroEval: Benchmarking Multimodal Deep Research Agents in Process and Outcome,0,online_same_domain_stream
2603.25027v1,pypdf,c6772a4d9d1ee3f63d0b3acf0856e60e122ca017,60040,cs.IR,Hyena Operator for Fast Sequential Recommendation,0,online_same_domain_stream
2603.29518v1,pypdf,dca9fa8dbf5976da807fa8ef4ef5eec643d8a2e7,113169,cs.CL,"Impact of enriched meaning representations for language generation in dialogue tasks: A comprehensive exploration of the relevance of tasks, corpora and metrics",0,online_same_domain_stream
2604.00557v1,pymupdf,85fa54d01df18038fef6383049bc4121d41da4a6,37920,cs.RO,Multi-Camera View Scaling for Data-Efficient Robot Imitation Learning,0,online_same_domain_stream
2604.00399v1,pypdf,4f4882fbdef5c89fb65534df6e48e1a99c0c22e2,60413,cs.LG,A Cross-graph Tuning-free GNN Prompting Framework,0,online_same_domain_stream
2602.17386v1,pypdf,50da439e7f1a3d0959cc8047c5951b1769d52250,33066,cs.AI,Visual Model Checking: Graph-Based Inference of Visual Routines for Image Retrieval,0,online_same_domain_stream
2604.01202v1,pymupdf,e5c6ebad14901866b36ddf15901be6486193bc9f,49033,cs.AI,Therefore I am. I Think,0,online_same_domain_stream
2604.00913v1,pymupdf,4b4c60134cf611d962446f7e413b8c437237b160,67267,cs.CV,Benchmarking and Mechanistic Analysis of Vision-Language Models for Cross-Depiction Assembly Instruction Alignment,0,online_same_domain_stream
2509.26330v1,pymupdf,84679c80ded9ddd32cfb312f84856ee1e4a5cd93,67744,cs.CV,SQUARE: Semantic Query-Augmented Fusion and Efficient Batch Reranking for Training-free Zero-Shot Composed Image Retrieval,0,online_same_domain_stream
2602.06190v1,pymupdf,12c81c4cde911c0c544ec50494b0ab90b248b2c6,95352,cs.HC,"Generics in science communication: Misaligned interpretations across laypeople, scientists, and large language models",0,online_same_domain_stream
2603.26544v1,pypdf,ce023ef378bc5d9b5867c5ac9eb1fda60efa42b5,60981,cs.CL,Development of a European Union Time-Indexed Reference Dataset for Assessing the Performance of Signal Detection Methods in Pharmacovigilance using a Large Language Model,0,online_same_domain_stream
