doc_id,parser_name,text_sha1,char_count,primary_category,title,label,stream_type
2603.29041v1,pypdf,51d504a74f4c8bec1ff3802bda027d1307a2aac7,65556,cs.LG,A Latent Risk-Aware Machine Learning Approach for Predicting Operational Success in Clinical Trials based on TrialsBank,1,online_same_domain_stream
2603.29184v1,pypdf,7be8c16c7ba3dfc50e310b2127b9ddfbde8cd58f,100443,cs.LG,Biomimetic PINNs for Cell-Induced Phase Transitions: UQ-R3 Sampling with Causal Gating,1,online_same_domain_stream
2603.25796v1,pymupdf,f5a715859d562d924ac9e130ba64792e2abe77cb,53525,stat.ML,Beyond identifiability: Learning causal representations with few environments and finite samples,0,online_same_domain_stream
2603.21418v1,pymupdf,9c7714ac708c9c78c0dbeadb252a24b150f33b2a,42453,cs.CL,Efficient Fine-Tuning Methods for Portuguese Question Answering: A Comparative Study of PEFT on BERTimbau and Exploratory Evaluation of Generative LLMs,0,online_same_domain_stream
2604.00788v1,pymupdf,b0eef52741eff145916ec516bf45559c5a9d5015,53540,cs.AI,UK AISI Alignment Evaluation Case-Study,0,online_same_domain_stream
2603.27467v1,pypdf,5e7a9d0e7796bd3c2df31ad69535a00163e87744,31763,cs.LG,TurboAngle: Near-Lossless KV Cache Compression via Uniform Angle Quantization,0,online_same_domain_stream
2603.29078v1,pypdf,ffe722f04bb4982275370b26810d1e7b63135643,33672,cs.CL,PolarQuant: Optimal Gaussian Weight Quantization via Hadamard Rotation for LLM Compression,0,online_same_domain_stream
2604.00050v1,pypdf,801ac7550949a84c5e91b27bd4a378013f42a1af,36244,cs.LG,Task-Centric Personalized Federated Fine-Tuning of Language Models,1,online_same_domain_stream
2603.23838v1,pymupdf,74bfea794f33545dcb8c7f829100d03bdacecb80,143696,cs.AI,Learning-guided Prioritized Planning for Lifelong Multi-Agent Path Finding in Warehouse Automation,1,online_same_domain_stream
2602.00805v1,pymupdf,66f9257fdf643f6d286e18139d484f963e4c7f13,25036,cs.IR,Optimizing Retrieval Components for a Shared Backbone via Component-Wise Multi-Stage Training,1,online_same_domain_stream
2603.25975v1,pypdf,82a93b8a5508b1c85d6e984cd42eb6945df04ff6,52201,cs.LG,Do Neurons Dream of Primitive Operators? Wake-Sleep Compression Rediscovers Schank's Event Semantics,1,online_same_domain_stream
2603.29801v1,pymupdf,9e5fc8b07813a897c1bd053c0e969a55033a029c,41759,cs.CL,ENEIDE: A High Quality Silver Standard Dataset for Named Entity Recognition and Linking in Historical Italian,1,online_same_domain_stream
2603.27914v2,pymupdf,4f2c4841f5d086ce82a933c8ba6a79af07fded4d,24566,cs.LG,ITQ3_S: High-Fidelity 3-bit LLM Inference via Interleaved Ternary Quantization with Rotation-Domain Smoothing,0,online_same_domain_stream
2603.28386v1,pypdf,d3153d3f1224c5e4e68858bd945ef004262138af,197083,cs.AI,COvolve: Adversarial Co-Evolution of Large-Language-Model-Generated Policies and Environments via Two-Player Zero-Sum Game,1,online_same_domain_stream
2603.26186v1,pypdf,9c612243a4178f0d3932c04a763a974123266798,44101,cs.CV,Progressive Learning with Anatomical Priors for Reliable Left Atrial Scar Segmentation from Late Gadolinium Enhancement MRI,1,online_same_domain_stream
2603.27467v1,pymupdf,eacc69d90df7828223a251cb1a2c8567eb961209,32208,cs.LG,TurboAngle: Near-Lossless KV Cache Compression via Uniform Angle Quantization,1,online_same_domain_stream
2601.14224v1,pymupdf,0ead4af4255ef01deaf53b4dfea7e2537f02d937,40018,cs.IR,Rerank Before You Reason: Analyzing Reranking Tradeoffs through Effective Token Cost in Deep Search Agents,1,online_same_domain_stream
2603.29406v1,pymupdf,752a04f9b867adee11de0b6b2202c54d163925be,81150,cs.LG,PRISM: PRIor from corpus Statistics for topic Modeling,1,online_same_domain_stream
2603.27819v1,pypdf,a812aea3c0bb2dc9f42ff34881a5449e48b0a04c,34729,cs.LG,KVSculpt: KV Cache Compression as Distillation,0,online_same_domain_stream
2603.07271v1,pypdf,99bb80bc2cb792cfd4703fed2903dab91ba8e179,40467,cs.IR,AutoDataset: A Lightweight System for Continuous Dataset Discovery and Search,0,online_same_domain_stream
2603.17714v1,pypdf,9730cae920aed3cc98534ca888399231fac2f144,117205,cs.AI,From Virtual Environments to Real-World Trials: Emerging Trends in Autonomous Driving,1,online_same_domain_stream
2603.27768v1,pymupdf,f602e871db29879e35c108ce32b2d0cc388115c7,65901,cs.CL,TailNLG: A Multilingual Benchmark Addressing Verbalization of Long-Tail Entities,0,online_same_domain_stream
2511.16528v1,pymupdf,12cdd9b45142ecd8505edae5e7adb17c383455a9,34180,cs.CL,TurkColBERT: A Benchmark of Dense and Late-Interaction Models for Turkish Information Retrieval,1,online_same_domain_stream
2603.27360v1,pypdf,3032885e2924020d32d3559e0d6e3923206aaa7a,39799,cs.AI,Defend: Automated Rebuttals for Peer Review with Minimal Author Guidance,1,online_same_domain_stream
2603.27008v1,pymupdf,136fcbf708493122b7f7f6acfa2096f811ad3617,32982,cs.CL,RASPRef: Retrieval-Augmented Self-Supervised Prompt Refinement for Large Reasoning Models,1,online_same_domain_stream
2603.25464v1,pypdf,3d100701dc007021d9b60e5fdbd4b3d776fba8d2,58075,cs.LG,Maximum Entropy Behavior Exploration for Sim2Real Zero-Shot Reinforcement Learning,1,online_same_domain_stream
2602.00665v2,pypdf,6a643fc7508113e106d611156c0223e681f39eff,75851,cs.CL,Can Small Language Models Handle Context-Summarized Multi-Turn Customer-Service QA? A Synthetic Data-Driven Comparative Evaluation,1,online_same_domain_stream
2603.04370v1,pypdf,3714aa9296bfee2ff8e732a5f0c145dbdb7b90d7,105935,cs.AI,$τ$-Knowledge: Evaluating Conversational Agents over Unstructured Knowledge,0,online_same_domain_stream
2603.28124v1,pypdf,557eadc1c0646a7b5faf9fc226f6ca7644d45ff0,31424,cs.IR,RCLRec: Reverse Curriculum Learning for Modeling Sparse Conversions in Generative Recommendation,1,online_same_domain_stream
2604.00599v1,pymupdf,4554738b4965e2e27d5ed0073f38e51760bd0f18,59831,cs.LG,Predicting Dynamics of Ultra-Large Complex Systems by Inferring Governing Equations,1,online_same_domain_stream
2602.23639v1,pymupdf,a314e380f3754108d8cbf5a4930761c44fc10fbd,69139,cs.IR,Learning to Reflect and Correct: Towards Better Decoding Trajectories for Large-Scale Generative Recommendation,0,online_same_domain_stream
2603.28315v1,pypdf,b064d450ee5634835507502b2b25efe78aa86c28,32369,cs.CV,Prototype-Enhanced Multi-View Learning for Thyroid Nodule Ultrasound Classification,1,online_same_domain_stream
2511.00072v1,pymupdf,3fa4ca16886ead5d1a438e3ea6f4932533f15e70,19280,cs.IR,LookSync: Large-Scale Visual Product Search System for AI-Generated Fashion Looks,1,online_same_domain_stream
2602.22220v1,pypdf,3d65ba13bdedb299e6a25b1c8567a7db39eef9e2,124786,cs.IR,"What Makes an Ideal Quote? Recommending ""Unexpected yet Rational"" Quotations via Novelty",1,online_same_domain_stream
2601.08654v1,pymupdf,2c0574776e28c94d2a9b48cf7774c80e0270091f,53370,cs.CL,RULERS: Locked Rubrics and Evidence-Anchored Scoring for Robust LLM Evaluation,0,online_same_domain_stream
2603.09296v1,pypdf,9642d0282114111d46c4193511b0c41c7169cd4e,108911,cs.IR,Diagnosing and Repairing Citation Failures in Generative Engine Optimization,1,online_same_domain_stream
2604.00284v1,pymupdf,02bedf9a729f5e2cdbb54a01573690a6766b9d45,36017,cs.AI,Improvisational Games as a Benchmark for Social Intelligence of AI Agents: The Case of Connections,0,online_same_domain_stream
2604.00195v1,pypdf,73142a6d11f4af38a08263ba3edde7b2bfcb5174,36503,cs.LG,Lévy-Flow Models: Heavy-Tail-Aware Normalizing Flows for Financial Risk Management,1,online_same_domain_stream
2603.24465v1,pypdf,26593809d6c6561fa556f0260a14d3454fb8bfab,73107,cs.CL,Mechanic: Sorrifier-Driven Formal Decomposition Workflow for Automated Theorem Proving,1,online_same_domain_stream
2603.29281v1,pypdf,5eebb712d538a2ebbd603bf0d1d0a98fb15c8ae3,86699,cs.CV,PRISM: A Multi-View Multi-Capability Retail Video Dataset for Embodied Vision-Language Models,1,online_same_domain_stream
2603.29617v1,pypdf,dbfad4662d1e36504e73f1d64db7620373c6df4b,55300,q-bio.NC,Convergent Representations of Linguistic Constructions in Human and Artificial Neural Systems,0,online_same_domain_stream
2603.24709v1,pymupdf,dc9d4df4737c9c72a401b04ca27846faad03a775,51924,cs.LG,Training LLMs for Multi-Step Tool Orchestration with Constrained Data Synthesis and Graduated Rewards,1,online_same_domain_stream
2604.00455v1,pypdf,dd024028accb288dd1d222dd5a1a92e46eaad56e,69720,cs.CV,First Logit Boosting: Visual Grounding Method to Mitigate Object Hallucination in Large Vision-Language Models,1,online_same_domain_stream
2603.16777v1,pymupdf,42a8bc7c823f81d02ad3817ae2bef020d52d1530,49570,cs.AI,Anticipatory Planning for Multimodal AI Agents,1,online_same_domain_stream
2601.05200v3,pypdf,ea12e6d453153c7d49578ae395a0a16745892c57,48696,cs.IR,Multivector Reranking in the Era of Strong First-Stage Retrievers,1,online_same_domain_stream
2603.24772v1,pymupdf,f13d9c104a50aafdf037b24297b8e84f2ec5adfa,51722,cs.CL,Evaluating Fine-Tuned LLM Model For Medical Transcription With Small Low-Resource Languages Validated Dataset,1,online_same_domain_stream
2603.19275v1,pymupdf,50e30848dad145bf5c744e923de5786e9cf71a3a,28141,cs.CL,Improving Automatic Summarization of Radiology Reports through Mid-Training of Large Language Models,1,online_same_domain_stream
2603.27752v1,pypdf,be0f5a265a6d35bf88f535da0f98260c063eb6c9,60902,cs.CL,Retromorphic Testing with Hierarchical Verification for Hallucination Detection in RAG,1,online_same_domain_stream
2603.26031v1,pypdf,95bf4fb7e77522055ae8caf6e756973eaa831563,83687,cs.HC,Designing Fatigue-Aware VR Interfaces via Biomechanical Models,1,online_same_domain_stream
2511.01386v1,pypdf,67687ca0384acd738d44ae107e06d36e52f588c8,147550,cs.CL,RAGSmith: A Framework for Finding the Optimal Composition of Retrieval-Augmented Generation Methods Across Datasets,0,online_same_domain_stream
2603.03770v1,pypdf,eba91a35ab047415aebf38afa287e5d6c4ff4718,55055,cs.IR,Not All Candidates are Created Equal: A Heterogeneity-Aware Approach to Pre-ranking in Recommender Systems,1,online_same_domain_stream
2603.27156v1,pymupdf,775b7031a6f6a99734734773353a986998a9eaff,40348,cs.LG,GSR-GNN: Training Acceleration and Memory-Saving Framework of Deep GNNs on Circuit Graph,1,online_same_domain_stream
2508.01514v1,pypdf,8a5f290830d268aa011a0dd601e80634ccc842c5,39857,cs.IR,End-to-End Personalization: Unifying Recommender Systems with Large Language Models,1,online_same_domain_stream
2510.00887v2,pymupdf,73f97ed111d17599b6902a6106c96e0f357dbc73,31769,cs.IR,On Listwise Reranking for Corpus Feedback,0,online_same_domain_stream
2603.26683v1,pypdf,e8861edc02776d4783dc0a82d844b13794795453,53922,cs.IR,LITTA: Late-Interaction and Test-Time Alignment for Visually-Grounded Multimodal Retrieval,1,online_same_domain_stream
2602.16673v1,pypdf,95e62bc27c6b3f452e13e84861fb47226c19add4,66141,cs.LG,Neighborhood Stability as a Measure of Nearest Neighbor Searchability,0,online_same_domain_stream
2508.05512v1,pypdf,2ea9ee4d8816d9d4dc46e4f5d6dd4a600ee3753e,31523,cs.IR,"RankArena: A Unified Platform for Evaluating Retrieval, Reranking and RAG with Human and LLM Feedback",0,online_same_domain_stream
2603.22922v1,pymupdf,c191a1080dfc6a69af4af3a6ffdb80a173e1b2a5,41384,cs.CL,Quality Over Clicks: Intrinsic Quality-Driven Iterative Reinforcement Learning for Cold-Start E-Commerce Query Suggestion,1,online_same_domain_stream
2603.18447v1,pypdf,19d23b1190426b23a13192a6d8fc8f9f3666190f,87608,cs.DB,SODIUM: From Open Web Data to Queryable Databases,0,online_same_domain_stream
2601.09001v3,pymupdf,13bc3baa5e1cd8d5af98d425b0fb4100b3ee573d,56298,cs.CL,Entropy Sentinel: Continuous LLM Accuracy Monitoring from Decoding Entropy Traces in STEM,1,online_same_domain_stream
2603.20673v1,pypdf,daa6f36b590f9ee458f87dc96f0ff714ed68de8e,27584,cs.CL,PAVE: Premise-Aware Validation and Editing for Retrieval-Augmented LLMs,0,online_same_domain_stream
2601.12154v1,pymupdf,67fff8443874c423d1a8fb7070fe561e72093611,76933,cs.CL,Analyzing Cancer Patients' Experiences with Embedding-based Topic Modeling and LLMs,1,online_same_domain_stream
2603.29139v1,pypdf,d22733c4c5cdf8501516144e849925941f93dd7b,111500,cs.AI,SciVisAgentBench: A Benchmark for Evaluating Scientific Data Analysis and Visualization Agents,1,online_same_domain_stream
2603.21886v1,pymupdf,c7275b5ee9b317d4326141e481b2424b4139d600,30828,cs.IR,ADaFuSE: Adaptive Diffusion-generated Image and Text Fusion for Interactive Text-to-Image Retrieval,1,online_same_domain_stream
2603.30035v1,pypdf,769a719597bfd18a73c842b9eaacb4deff1bfb03,16423,cs.LG,Reward-Based Online LLM Routing via NeuralUCB,1,online_same_domain_stream
2603.25189v1,pymupdf,d9337fae9fa6cf9122e9f6af3001567b35166679,51482,cs.CL,A Catalog of Basque Dialectal Resources: Online Collections and Standard-to-Dialectal Adaptations,0,online_same_domain_stream
2603.25796v1,pypdf,b43b34ab0934cd07b26402ea83acc1efeec489bb,53073,stat.ML,Beyond identifiability: Learning causal representations with few environments and finite samples,1,online_same_domain_stream
2604.00689v1,pymupdf,05c2a15e1aebc3759500b2018c039c4151746e47,115675,cs.LG,Performance of Neural and Polynomial Operator Surrogates,1,online_same_domain_stream
2604.00911v1,pymupdf,d4aa581040ffcec784ee06234a14d7efabe7bf56,30657,cs.LG,Event Embedding of Protein Networks : Compositional Learning of Biological Function,0,online_same_domain_stream
2604.00120v1,pypdf,d31cb2a2e0d88a8accee9c11ab649564f852c172,59836,cs.SE,From Domain Understanding to Design Readiness: a playbook for GenAI-supported learning in Software Engineering,0,online_same_domain_stream
2603.27653v1,pypdf,5cf12eb038411aa521b963f0f84bc42270e2de4f,32279,cs.CL,The Degree of Language Diacriticity and Its Effect on Tasks,1,online_same_domain_stream
2603.29405v1,pymupdf,6da13ffadaa13546062406a085407727abf0bb5f,78816,cs.CV,Hallucination-aware intermediate representation edit in large vision-language models,1,online_same_domain_stream
2603.27539v1,pypdf,0d43aca3045f55cc9ccc790df03a61a17cae9c8d,33359,cs.MA,"Toward Reliable Evaluation of LLM-Based Financial Multi-Agent Systems: Taxonomy, Coordination Primacy, and Cost Awareness",0,online_same_domain_stream
2603.26720v1,pypdf,f1f86c6276c33a5100fed804be9374ae8717db0b,40218,cs.RO,SutureAgent: Learning Surgical Trajectories via Goal-conditioned Offline RL in Pixel Space,1,online_same_domain_stream
2603.23516v1,pypdf,fd50720538a2e9880a109b3b14f9386879e244a7,71900,cs.CL,MSA: Memory Sparse Attention for Efficient End-to-End Memory Model Scaling to 100M Tokens,1,online_same_domain_stream
2603.25248v1,pypdf,f56d52d45aa362cc3ecf3d9d3d490d27e75590ec,19653,cs.IR,ColBERT-Att: Late-Interaction Meets Attention for Enhanced Retrieval,0,online_same_domain_stream
2603.02555v1,pymupdf,3862a9139001845c0d0ec85d383e78b8fb11ad84,40111,cs.IR,Relevance Matters: A Multi-Task and Multi-Stage Large Language Model Approach for E-commerce Query Rewriting,0,online_same_domain_stream
2603.29217v1,pypdf,8ee6626e74e52f657b12cf36f028c7209e07f3bf,27898,eess.AS,Advancing LLM-based phoneme-to-grapheme for multilingual speech recognition,0,online_same_domain_stream
2603.24981v1,pypdf,5a4e8d49211bbb44d48e4477cacc6bc71efb27d1,59283,cs.CL,Exons-Detect: Identifying and Amplifying Exonic Tokens via Hidden-State Discrepancy for Robust AI-Generated Text Detection,0,online_same_domain_stream
2510.25220v1,pymupdf,b3fd929bc3eb13398675d2ae940449f23d0eca0d,48372,cs.IR,GReF: A Unified Generative Framework for Efficient Reranking via Ordered Multi-token Prediction,1,online_same_domain_stream
2603.28583v1,pypdf,4acfe85cdbb93e25b415f747f8ea683a3b029314,54735,cs.CV,Navigating the Mirage: A Dual-Path Agentic Framework for Robust Misleading Chart Question Answering,1,online_same_domain_stream
2603.29088v1,pymupdf,dc4cedd22d36410d58dd04a22985100cb0ecff70,227733,cs.SE,WybeCoder: Verified Imperative Code Generation,0,online_same_domain_stream
2603.22073v1,pypdf,d23b6ef0fea565a125da607dc81d162d35e886b9,87307,cs.IR,PreferRec: Learning and Transferring Pareto Preferences for Multi-objective Re-ranking,0,online_same_domain_stream
2603.29861v1,pypdf,0764d8ebc26c49a1a3f203999ad3a6b59423d9ad,68201,cs.CL,Towards Empowering Consumers through Sentence-level Readability Scoring in German ESG Reports,1,online_same_domain_stream
2601.09504v2,pymupdf,d15d25e5e8d26bf68d478a048b318d7e31131663,58388,cs.CL,MVSS: A Unified Framework for Multi-View Structured Survey Generation,1,online_same_domain_stream
2509.25085v4,pymupdf,b98be7cadcc25884f26b6a40c989722c16bea9bb,37510,cs.CL,jina-reranker-v3: Last but Not Late Interaction for Listwise Document Reranking,1,online_same_domain_stream
2604.00477v1,pymupdf,c070ce74609f7f197072059fae7ff39d41ed234c,44466,cs.AI,"Logarithmic Scores, Power-Law Discoveries: Disentangling Measurement from Coverage in Agent-Based Evaluation",0,online_same_domain_stream
2603.27950v1,pymupdf,d11861ffaf34b4e93c3fd65a2530347d4ce1f0c8,188570,cs.LG,Scaling Atomistic Protein Binder Design with Generative Pretraining and Test-Time Compute,1,online_same_domain_stream
2603.28321v1,pymupdf,07547cf22163ab7add20332f2ae88e1cffd2e967,32642,cs.LG,FairGC: Fairness-aware Graph Condensation,0,online_same_domain_stream
2602.22576v1,pymupdf,5d8b2aab62e26bd194761c788a80553b042b6ab9,52036,cs.CL,Search-P1: Path-Centric Reward Shaping for Stable and Efficient Agentic RAG Training,0,online_same_domain_stream
2511.05079v1,pypdf,ed9760852952da4fe3be1306b85944a5fafe7a37,48872,cs.IR,Wikipedia-based Datasets in Russian Information Retrieval Benchmark RusBEIR,1,online_same_domain_stream
2603.28114v1,pypdf,a9fefbe4d299eca29716854103b068d332f216ea,39360,cs.CV,Attention Frequency Modulation: Training-Free Spectral Modulation of Diffusion Cross-Attention,1,online_same_domain_stream
2603.23037v1,pymupdf,43c7f1bc388e4df1080c96cd569b1cfa8e0d8d55,56652,cs.CV,YOLOv10 with Kolmogorov-Arnold networks and vision-language foundation models for interpretable object detection and trustworthy multimodal AI in computer vision perception,1,online_same_domain_stream
2603.29974v1,pymupdf,76e1e8a4c103fdd731c13609b8da8ce53a254014,67172,cs.LG,Meteorology-Driven GPT4AP: A Multi-Task Forecasting LLM for Atmospheric Air Pollution in Data-Scarce Settings,1,online_same_domain_stream
2603.27541v1,pymupdf,27d923b6464a205b4d6c48aff0dbb8e903ccaa10,107095,cs.NE,A Novel Immune Algorithm for Multiparty Multiobjective Optimization,1,online_same_domain_stream
2603.29871v1,pymupdf,3bca0dce87afbb37ba89000d5b932fe5fb71b291,72907,cs.AI,ShapE-GRPO: Shapley-Enhanced Reward Allocation for Multi-Candidate LLM Training,1,online_same_domain_stream
2604.00917v1,pymupdf,30d786e59e06ffccb4fc35208e673fc68b44a26d,74393,cs.SE,Investigating Autonomous Agent Contributions in the Wild: Activity Patterns and Code Change over Time,0,online_same_domain_stream
2603.27952v1,pypdf,372608c82c0bd6306b80cf5e49e2fb8d06ef626c,88981,cs.IR,On the Accuracy Limits of Sequential Recommender Systems: An Entropy-Based Approach,0,online_same_domain_stream
2602.17654v1,pymupdf,6fb201c7a0fcfff83d3b7fd2a522c120ae0946cf,53748,cs.IR,Mine and Refine: Optimizing Graded Relevance in E-commerce Search Retrieval,1,online_same_domain_stream
2603.26100v1,pymupdf,ab6bcdcb5f66fa459eccc2f68082b552bed215ec,19745,cs.IR,Rethinking Recommendation Paradigms: From Pipelines to Agentic Recommender Systems,1,online_same_domain_stream
2604.00399v1,pymupdf,cb136dbc8bb6b88d06d995a49303d5dccd772d2a,62073,cs.LG,A Cross-graph Tuning-free GNN Prompting Framework,1,online_same_domain_stream
2604.01151v1,pymupdf,baaabe5b5de3bfe375f96d3c6513f0b4a0b939af,39682,cs.AI,Detecting Multi-Agent Collusion Through Multi-Agent Interpretability,1,online_same_domain_stream
2603.29643v1,pypdf,5e07bfa9717cb8e7e3f16dc9ab0897384820ab36,65858,cs.AI,Optimizing Donor Outreach for Blood Collection Sessions: A Scalable Decision Support Framework,0,online_same_domain_stream
2603.26828v1,pymupdf,9722aa2c87996da404e4f6f8b66e1cd0835b7e5d,40386,cs.CL,Arithmetic OOD Failure Unfolds in Stages in Minimal GPTs,1,online_same_domain_stream
2603.18447v1,pymupdf,6f5686eb3377d33a8c6391e4f73143bcc8c02558,88201,cs.DB,SODIUM: From Open Web Data to Queryable Databases,1,online_same_domain_stream
2603.26089v1,pymupdf,29eba0ef47a997ca9f24c82b381c0f157be31dbf,67932,cs.LG,Selective Deficits in LLM Mental Self-Modeling in a Behavior-Based Test of Theory of Mind,1,online_same_domain_stream
2603.20286v1,pymupdf,a5498afed1dd51fc131a7a1c6362f505e15e2cd4,60241,cs.IR,Rethinking Retrieval-Augmentation as Synthesis: A Query-Aware Context Merging Approach,1,online_same_domain_stream
2603.20299v1,pymupdf,8615c7b8d03699ee6671e96e3be7ec1df13e1f17,49746,cs.SE,HCAG: Hierarchical Abstraction and Retrieval-Augmented Generation on Theoretical Repositories with LLMs,0,online_same_domain_stream
2603.17420v1,pymupdf,d0e96646fdeed354b803fd817061811db05c5dde,116514,cs.AI,"From Digital Twins to World Models:Opportunities, Challenges, and Applications for Mobile Edge General Intelligence",1,online_same_domain_stream
2603.23750v1,pypdf,d888faa9680588a53dacc47ae7d193eb0598f871,48729,cs.CL,IslamicMMLU: A Benchmark for Evaluating LLMs on Islamic Knowledge,1,online_same_domain_stream
2603.28942v1,pymupdf,5672b7f9e3fb1b4ecc84151bdf39f195fc93057f,154329,cs.LG,\texttt{ReproMIA}: A Comprehensive Analysis of Model Reprogramming for Proactive Membership Inference Attacks,1,online_same_domain_stream
2602.05334v1,pymupdf,68a11ec1028c9961ad6e3cf72e2adbfae4e1a256,52325,cs.IR,NeuCLIRTech: Chinese Monolingual and Cross-Language Information Retrieval Evaluation in a Challenging Domain,1,online_same_domain_stream
2603.28086v1,pypdf,45d7e7f10c6b5a357432274e6c4c531ff6196341,33088,cs.SD,MOSS-VoiceGenerator: Create Realistic Voices with Natural Language Descriptions,1,online_same_domain_stream
2508.16998v1,pypdf,35797e0a7ade19d243fd79b79dc22995d7a7002b,50540,cs.CL,DeAR: Dual-Stage Document Reranking with Reasoning Agents via LLM Distillation,1,online_same_domain_stream
2602.16964v1,pypdf,cc62d9d8da5cef993813949f27faefcc701aa6a7,95372,cs.IR,SAGE: Structure Aware Graph Expansion for Retrieval of Heterogeneous Data,1,online_same_domain_stream
2602.21600v1,pypdf,3b0e3451619410261c3bd90c7cc312391cb064b9,39849,cs.IR,AQR-HNSW: Accelerating Approximate Nearest Neighbor Search via Density-aware Quantization and Multi-stage Re-ranking,0,online_same_domain_stream
2603.09403v1,pypdf,b035e2fa0c64bad070dc85473dcb3ee456716b1f,61837,cs.CL,LLM as a Meta-Judge: Synthetic Data for NLP Evaluation Metric Validation,1,online_same_domain_stream
2509.15588v1,pypdf,8f8d053f78385b6b5403ff99fcc87d65984fcc98,40927,cs.IR,CFDA & CLIP at TREC iKAT 2025: Enhancing Personalized Conversational Search via Query Reformulation and Rank Fusion,1,online_same_domain_stream
2603.03297v1,pymupdf,be0ce74824688f153cd576d72645a0778a3139d8,47424,cs.CL,TTSR: Test-Time Self-Reflection for Continual Reasoning Improvement,0,online_same_domain_stream
2601.21115v1,pymupdf,84c4f9ea1716d6a58780876181eb444f21c5b2af,79420,cs.CL,Multi-task Code LLMs: Data Mix or Model Merge?,1,online_same_domain_stream
2604.01173v1,pymupdf,d2112e0562f77b6cebd186412d645a3fd384d40c,43896,eess.SY,Safe learning-based control via function-based uncertainty quantification,1,online_same_domain_stream
2603.23229v1,pymupdf,56cd844f75770296c5d27e84ed9e8483efcfa5bd,64435,cs.CL,"I Came, I Saw, I Explained: Benchmarking Multimodal LLMs on Figurative Meaning in Memes",1,online_same_domain_stream
2604.00307v1,pymupdf,bb139b034d3618b49fb8212a890e9bba121390bf,26811,cs.LG,SAGE: Subsurface AI-driven Geostatistical Extraction with proxy posterior,0,online_same_domain_stream
2603.02561v1,pymupdf,c1aaa2b7e43ba00d47ce1948246057b8a7f1cae9,59725,cs.IR,SOLAR: SVD-Optimized Lifelong Attention for Recommendation,0,online_same_domain_stream
2603.27880v1,pypdf,7c185386f89e82945c98949468dd5aa2b822cc6f,34497,cs.LG,Kernel Dynamics under Path Entropy Maximization,1,online_same_domain_stream
2603.23251v1,pymupdf,eecc589c1426f932bd66c5ec825e9e867dec1574,67080,cs.CL,"Is AI Catching Up to Human Expression? Exploring Emotion, Personality, Authorship, and Linguistic Style in English and Arabic with Six Large Language Models",1,online_same_domain_stream
2603.20449v1,pypdf,debea2aca5cb0a851493531eaee0fb6a5c5cc2bc,27250,cs.SE,Solver-Aided Verification of Policy Compliance in Tool-Augmented LLM Agents,1,online_same_domain_stream
2602.02053v2,pymupdf,784c29a6abc3a3d61831a912b8d04342f08d7842,49554,cs.CL,WildGraphBench: Benchmarking GraphRAG with Wild-Source Corpora,0,online_same_domain_stream
2509.11353v1,pypdf,ebb0da4a7b899ee9c5ba8015b7bf3fe709aa61b4,54407,cs.IR,Do Large Language Models Favor Recent Content? A Study on Recency Bias in LLM-Based Reranking,0,online_same_domain_stream
2510.23544v1,pymupdf,99505af7bc9b9ceec3b8643c9059ca747881450e,60825,cs.CL,LimRank: Less is More for Reasoning-Intensive Information Reranking,1,online_same_domain_stream
2603.20975v1,pypdf,b763b454a0da434bdf3ae7c858dadc228f9d83d5,40744,cs.CL,DiscoUQ: Structured Disagreement Analysis for Uncertainty Quantification in LLM Agent Ensembles,1,online_same_domain_stream
2603.28618v1,pymupdf,467fde9f71e7f2eb0307765996ade91110622983,77098,cs.AI,Seeing with You: Perception-Reasoning Coevolution for Multimodal Reasoning,1,online_same_domain_stream
2603.28537v2,pypdf,66d2d02a64c16fbb6e378a58b3fb50d6107bc6a3,27600,cs.CL,Training data generation for context-dependent rubric-based short answer grading,1,online_same_domain_stream
2603.21594v1,pymupdf,4a5462c21c02683fa318e8f90484f6e1b750e865,78202,cs.IT,Spatio-Temporal Attention Enhanced Multi-Agent DRL for UAV-Assisted Wireless Networks with Limited Communications,0,online_same_domain_stream
2603.29543v1,pymupdf,ca185dde456001fda945ea0054396fa1cb2d557f,27084,quant-ph,Reducing Complexity for Quantum Approaches in Train Load Optimization,1,online_same_domain_stream
2603.28678v1,pymupdf,d395578ec4b6b38ad3dfa9e1fdbde1224fcd5841,52183,cs.LG,Subspace Optimization for Backpropagation-Free Continual Test-Time Adaptation,1,online_same_domain_stream
2603.27029v1,pymupdf,401e7d39bf3659cdce87e914efdbdf0f42b7295a,47386,cs.CV,YOLO Object Detectors for Robotics -- a Comparative Study,1,online_same_domain_stream
